Name,City,State,Zip,EIN,Source,Goals,Category of Work,Methods,Focus Areas
Jamestown Community Center,San Francisco,CA,94110,943213124,AmeriCorps,Service & Volunteerism,Service & Volunteerism,Service and Volunteerism,Capacity Building; Education; Healthy Futures
"Jannus, Inc.",Boise,ID,83702,816035382,AmeriCorps,Service & Volunteerism,Service & Volunteerism,Service and Volunteerism,Education
Jefferson Park Ministries Inc,Elizabeth,NJ,07202,010659307,AmeriCorps,Service & Volunteerism,Service & Volunteerism,Service and Volunteerism,Education
"Jefferson, Parish Of",Gretna,LA,70053,726013920,AmeriCorps,Service & Volunteerism,Service & Volunteerism,Service and Volunteerism,Disaster Services; Economic Opportunity; Healthy Futures
Jennings Public Schools,Jennings,OK,74038,731137401,AmeriCorps,Service & Volunteerism,Service & Volunteerism,Service and Volunteerism,Education
Jericho Road Episcopal Housing Iniatiative,New Orleans,LA,70115,720475542,AmeriCorps,Service & Volunteerism,Service & Volunteerism,Service and Volunteerism,Capacity Building; Economic Opportunity
"Jesse Tree of Idaho, Inc., The",Boise,ID,83702,820534777,AmeriCorps,Service & Volunteerism,Service & Volunteerism,Service and Volunteerism,Capacity Building; Economic Opportunity
Jesuit Volunteer Corps: Northwest,Milwaukie,OR,97222,237361814,AmeriCorps,Service & Volunteerism,Service & Volunteerism,Service and Volunteerism,Capacity Building; Healthy Futures
"Jewish Council For The Aging Of Greater Washington, Inc.",Rockville,MD,20852,520983740,AmeriCorps,Service & Volunteerism,Service & Volunteerism,Service and Volunteerism,Education
"Jewish Family & Vocational Service of Middlesex County, Inc.",North Brunswick,NJ,08902,222281774,AmeriCorps,Service & Volunteerism,Service & Volunteerism,Service and Volunteerism,Economic Opportunity; Healthy Futures
Jewish Family Service Agency,Las Vegas,NV,89146,880142948,AmeriCorps,Service & Volunteerism,Service & Volunteerism,Service and Volunteerism,Education; Healthy Futures
Jewish Family Service of Atlantic County,Margate City,NJ,08402,222119902,AmeriCorps,Service & Volunteerism,Service & Volunteerism,Service and Volunteerism,Healthy Futures
"Jewish Family Services of Washtenaw County, Inc.",Ann Arbor,MI,48104,412147486,AmeriCorps,Service & Volunteerism,Service & Volunteerism,Service and Volunteerism,Capacity Building; Economic Opportunity; Education; Healthy Futures
"Jewish Family and Children's Services of Northern New Jersey, Inc.",Teaneck,NJ,07666,222223109,AmeriCorps,Service & Volunteerism,Service & Volunteerism,Service and Volunteerism,Healthy Futures
Jewish Renaissance Foundation,Edison,NJ,08837,223439175,AmeriCorps,Service & Volunteerism,Service & Volunteerism,Service and Volunteerism,Healthy Futures
Jobs for Arizona's Graduates,Phoenix,AZ,85051,860669709,AmeriCorps,Service & Volunteerism,Service & Volunteerism,Service and Volunteerism,Capacity Building; Education
John Carroll University,University Heights,OH,44118,340714681,AmeriCorps,Service & Volunteerism,Service & Volunteerism,Service and Volunteerism,Education; Healthy Futures
John H Boner Community Center,Indianapolis,IN,46201,237204495,AmeriCorps,Service & Volunteerism,Service & Volunteerism,Service and Volunteerism,Capacity Building; Economic Opportunity
John Wood Community College,Quincy,IL,62305,421027794,AmeriCorps,Service & Volunteerism,Service & Volunteerism,Service and Volunteerism,Disaster Services; Economic Opportunity; Healthy Futures; Veterans and Military Families
"Joyful Readers, Inc",Philadelphia,PA,19145,862200001,AmeriCorps,Service & Volunteerism,Service & Volunteerism,Service and Volunteerism,Education
Judiciary Courts of the State of Arizona,Phoenix,AZ,85007,866004791,AmeriCorps,Service & Volunteerism,Service & Volunteerism,Service and Volunteerism,Capacity Building
"Jumpstart for Young Children, Inc.",Boston,MA,02210,043262046,AmeriCorps,Service & Volunteerism,Service & Volunteerism,Service and Volunteerism,Education
Junior Achievement of Arkansas,Little Rock,AR,72201,710658775,AmeriCorps,Service & Volunteerism,Service & Volunteerism,Service and Volunteerism,Capacity Building; Education
Junta Central Para Asuntos De La Vejez Inc,Caguas,PR,00725,660570347,AmeriCorps,Service & Volunteerism,Service & Volunteerism,Service and Volunteerism,Healthy Futures
Justice Innovation Inc.,New York,NY,10018,852810883,AmeriCorps,Service & Volunteerism,Service & Volunteerism,Service and Volunteerism,Economic Opportunity
KANKAKEE SCHOOL DISTRICT 111,Kankakee,IL,60901,366004784,AmeriCorps,Service & Volunteerism,Service & Volunteerism,Service and Volunteerism,Education
"KANSAS ASSOCIATION FOR CONSERVATION & ENVIRONMENTAL EDUCATION, THE",Manhattan,KS,66502,480850919,AmeriCorps,Service & Volunteerism,Service & Volunteerism,Service and Volunteerism,Environmental Stewardship
"KANSAS CITY TEACHER RESIDENCY, INC",Kansas City,MO,64108,475135488,AmeriCorps,Service & Volunteerism,Service & Volunteerism,Service and Volunteerism,Education
"KANSAS DEPARTMENT OF WILDLIFE, PARKS AND TOURISM",Topeka,KS,66612,486029925,AmeriCorps,Service & Volunteerism,Service & Volunteerism,Service and Volunteerism,Environmental Stewardship
"KENTUCKY RIVER AREA DEVELOPMENT DISTRICT, INC.",Hazard,KY,41701,610675786,AmeriCorps,Service & Volunteerism,Service & Volunteerism,Service and Volunteerism,Capacity Building; Economic Opportunity
KINGDOM HOUSE INC,Saint Louis,MO,63104,430652648,AmeriCorps,Service & Volunteerism,Service & Volunteerism,Service and Volunteerism,Healthy Futures
"KIWANIS ACTIVITIES OF LITTLE ROCK, ARKANSAS INC",Little Rock,AR,72223,716017419,AmeriCorps,Service & Volunteerism,Service & Volunteerism,Service and Volunteerism,Education
Kankakee County States Attorney,Kankakee,IL,60901,366006594,AmeriCorps,Service & Volunteerism,Service & Volunteerism,Service and Volunteerism,Economic Opportunity; Education
Kansas City Public Library,Kansas City,MO,64105,431497955,AmeriCorps,Service & Volunteerism,Service & Volunteerism,Service and Volunteerism,Capacity Building; Economic Opportunity; Education; Healthy Futures
Kansas State Department of Education,Topeka,KS,66612,481124839,AmeriCorps,Service & Volunteerism,Service & Volunteerism,Service and Volunteerism,Capacity Building
"Kauai, County of",Lihue,HI,96766,996000658,AmeriCorps,Service & Volunteerism,Service & Volunteerism,Service and Volunteerism,Capacity Building; Economic Opportunity; Environmental Stewardship; Healthy Futures
Kennebec Valley Community Action Program,Waterville,ME,04901,010277678,AmeriCorps,Service & Volunteerism,Service & Volunteerism,Service and Volunteerism,Capacity Building; Education
Kennesaw State University Research and Service Foundation,Kennesaw,GA,30144,371535589,AmeriCorps,Service & Volunteerism,Service & Volunteerism,Service and Volunteerism,Capacity Building; Economic Opportunity; Education; Environmental Stewardship; Healthy Futures; Veterans and Military Families
"Kenosha Area Family and Aging Services, Inc",Kenosha,WI,53143,391132382,AmeriCorps,Service & Volunteerism,Service & Volunteerism,Service and Volunteerism,Education; Healthy Futures
Kent State University,Kent,OH,44242,316402079,AmeriCorps,Service & Volunteerism,Service & Volunteerism,Service and Volunteerism,Capacity Building; Economic Opportunity; Education; Healthy Futures; Veterans and Military Families
Kentucky Conference For Community and Justice,Lexington,KY,40508,371500795,AmeriCorps,Service & Volunteerism,Service & Volunteerism,Service and Volunteerism,Capacity Building; Economic Opportunity; Education; Environmental Stewardship; Healthy Futures
Kentucky Environmental Education Council,Frankfort,KY,40601,271709532,AmeriCorps,Service & Volunteerism,Service & Volunteerism,Service and Volunteerism,Environmental Stewardship
"Kentucky Health Departments Association, Inc.",Frankfort,KY,40601,311535010,AmeriCorps,Service & Volunteerism,Service & Volunteerism,Service and Volunteerism,Capacity Building
Kern County Superintendent of Schools,Bakersfield,CA,93301,956000941,AmeriCorps,Service & Volunteerism,Service & Volunteerism,Service and Volunteerism,Education
"Keystone SMILES Community Learning Center, Inc.",Knox,PA,16232,251764570,AmeriCorps,Service & Volunteerism,Service & Volunteerism,Service and Volunteerism,Education
Ki Bois Community Action Foundation Inc,Stigler,OK,74462,730770231,AmeriCorps,Service & Volunteerism,Service & Volunteerism,Service and Volunteerism,Capacity Building; Economic Opportunity; Education; Healthy Futures; Veterans and Military Families
"Kid Power, Inc.",Washington,DC,20024,262333511,AmeriCorps,Service & Volunteerism,Service & Volunteerism,Service and Volunteerism,Capacity Building; Education; Healthy Futures
"Kids in Tech, Inc.",Lowell,MA,01854,813311916,AmeriCorps,Service & Volunteerism,Service & Volunteerism,Service and Volunteerism,Capacity Building; Education
Knoxville Knox County Community Action Committee,Knoxville,TN,37921,626000700,AmeriCorps,Service & Volunteerism,Service & Volunteerism,Service and Volunteerism,Capacity Building; Economic Opportunity; Education; Environmental Stewardship; Healthy Futures
Kokua Kalihi Valley Comprehensive Family Services,Honolulu,HI,96819,990149797,AmeriCorps,Service & Volunteerism,Service & Volunteerism,Service and Volunteerism,Capacity Building; Economic Opportunity; Education; Environmental Stewardship; Healthy Futures
"Korean Community Services of Metropolitan New York, Inc.",Bayside,NY,11361,237348989,AmeriCorps,Service & Volunteerism,Service & Volunteerism,Service and Volunteerism,Healthy Futures
Kupu,Honolulu,HI,96813,510652665,AmeriCorps,Service & Volunteerism,Service & Volunteerism,Service and Volunteerism,Disaster Services; Environmental Stewardship
LA PUENTE HOME INC,Alamosa,CO,81101,742224631,AmeriCorps,Service & Volunteerism,Service & Volunteerism,Service and Volunteerism,Capacity Building
LA WORKS,Los Angeles,CA,90065,954329727,AmeriCorps,Service & Volunteerism,Service & Volunteerism,Service and Volunteerism,Capacity Building; Disaster Services; Economic Opportunity; Education; Healthy Futures
"LAFAYETTE COUNCIL ON THE AGING, INC.",Lafayette,LA,70508,720649877,AmeriCorps,Service & Volunteerism,Service & Volunteerism,Service and Volunteerism,Education
LBJ & C DEVELOPMENT CORP,Cookeville,TN,38501,620724384,AmeriCorps,Service & Volunteerism,Service & Volunteerism,Service and Volunteerism,Education; Healthy Futures
"LEEZA GIBBONS MEMORY FOUNDATION, INC.",West Hollywood,CA,90048,562356697,AmeriCorps,Service & Volunteerism,Service & Volunteerism,Service and Volunteerism,Capacity Building; Healthy Futures
"LENAWEE, COUNTY OF",Adrian,MI,49221,386005798,AmeriCorps,Service & Volunteerism,Service & Volunteerism,Service and Volunteerism,Education
LEO INC,Lynn,MA,01901,042378885,AmeriCorps,Service & Volunteerism,Service & Volunteerism,Service and Volunteerism,Capacity Building; Economic Opportunity; Education
"LIFESPAN OF GREATER ROCHESTER, INC.",Rochester,NY,14618,160986298,AmeriCorps,Service & Volunteerism,Service & Volunteerism,Service and Volunteerism,Economic Opportunity; Healthy Futures
LINC ST. CHARLES COUNTY,Wentzville,MO,63385,431632556,AmeriCorps,Service & Volunteerism,Service & Volunteerism,Service and Volunteerism,Education
"LITERACY ALLIANCE OF NORTHEAST FLORIDA, INC.",Jacksonville,FL,32202,237153919,AmeriCorps,Service & Volunteerism,Service & Volunteerism,Service and Volunteerism,Economic Opportunity
"LITERACY DELAWARE, INC.",Wilmington,DE,19801,510410054,AmeriCorps,Service & Volunteerism,Service & Volunteerism,Service and Volunteerism,Education
LITERACY VOLUNTEERS OF AMERICA-LACLEDE LITERACY COUNCIL,Lebanon,MO,65536,431499659,AmeriCorps,Service & Volunteerism,Service & Volunteerism,Service and Volunteerism,Economic Opportunity; Education
LITERATIONS CORP.,Boston,MA,02110,043227007,AmeriCorps,Service & Volunteerism,Service & Volunteerism,Service and Volunteerism,Education
LIVE THE SOLUTION,Tucson,AZ,85704,261151754,AmeriCorps,Service & Volunteerism,Service & Volunteerism,Service and Volunteerism,Education
LOU CNTRL COMMUNITY CENTER INC,Louisville,KY,40203,610590743,AmeriCorps,Service & Volunteerism,Service & Volunteerism,Service and Volunteerism,Capacity Building; Education
LOUISVILLE-JEFFERSON COUNTY METRO GOVERNMENT,Louisville,KY,40202,320049006,AmeriCorps,Service & Volunteerism,Service & Volunteerism,Service and Volunteerism,Education; Healthy Futures
LUTHERAN HOMES INC.,Fort Wayne,IN,46816,350885590,AmeriCorps,Service & Volunteerism,Service & Volunteerism,Service and Volunteerism,Education
"LUTHERAN SOCIAL SERVICES OF UPSTATE NEW YORK, INC.",Jamestown,NY,14701,160765309,AmeriCorps,Service & Volunteerism,Service & Volunteerism,Service and Volunteerism,Education; Environmental Stewardship; Healthy Futures
LYCOMING-CLINTON COUNTIES COMMISSION FOR COMMUNITY ACTION INC,Williamsport,PA,17701,231668784,AmeriCorps,Service & Volunteerism,Service & Volunteerism,Service and Volunteerism,Capacity Building; Healthy Futures
Lake Avenue Community Foundation,Pasadena,CA,91101,954847950,AmeriCorps,Service & Volunteerism,Service & Volunteerism,Service and Volunteerism,Capacity Building; Education
Lake County Community Fund,Leadville,CO,80461,814684882,AmeriCorps,Service & Volunteerism,Service & Volunteerism,Service and Volunteerism,Capacity Building
"Lancaster County Council on Aging, Inc.",Lancaster,SC,29720,570161585,AmeriCorps,Service & Volunteerism,Service & Volunteerism,Service and Volunteerism,Healthy Futures
"Land And Natural Resources, Hawaii Dept Of",Honolulu,HI,96813,990266119,AmeriCorps,Service & Volunteerism,Service & Volunteerism,Service and Volunteerism,Capacity Building; Education
Land of Lincoln Legal Aid,East Saint Louis,IL,62203,370958448,AmeriCorps,Service & Volunteerism,Service & Volunteerism,Service and Volunteerism,Capacity Building
Land of Sky Regional Council,Asheville,NC,28806,561024369,AmeriCorps,Service & Volunteerism,Service & Volunteerism,Service and Volunteerism,Education; Healthy Futures
Lane College,Jackson,TN,38301,620570060,AmeriCorps,Service & Volunteerism,Service & Volunteerism,Service and Volunteerism,Capacity Building; Economic Opportunity; Education
Lane Community College,Eugene,OR,97405,930546223,AmeriCorps,Service & Volunteerism,Service & Volunteerism,Service and Volunteerism,Healthy Futures
Latin American Association Inc,Atlanta,GA,30324,581237316,AmeriCorps,Service & Volunteerism,Service & Volunteerism,Service and Volunteerism,Capacity Building; Economic Opportunity
"Latin American Youth Center, Inc",Washington,DC,20009,521023074,AmeriCorps,Service & Volunteerism,Service & Volunteerism,Service and Volunteerism,Education; Healthy Futures
Laurel,Laurel,MS,39440,640527224,AmeriCorps,Service & Volunteerism,Service & Volunteerism,Service and Volunteerism,Education
"Lawrence, City of",Lawrence,MA,01840,046001394,AmeriCorps,Service & Volunteerism,Service & Volunteerism,Service and Volunteerism,Healthy Futures
Lead Up,Lincoln,NE,68508,815090400,AmeriCorps,Service & Volunteerism,Service & Volunteerism,Service and Volunteerism,Capacity Building; Education
LearnServe International,Washington,DC,20015,800208444,AmeriCorps,Service & Volunteerism,Service & Volunteerism,Service and Volunteerism,Capacity Building; Education
Lee County Literacy Coalition,Opelika,AL,36801,631010124,AmeriCorps,Service & Volunteerism,Service & Volunteerism,Service and Volunteerism,Capacity Building; Economic Opportunity; Education
Leeward District ELL Program,Waipahu,HI,96797,990266482,AmeriCorps,Service & Volunteerism,Service & Volunteerism,Service and Volunteerism,Capacity Building; Economic Opportunity; Education; Healthy Futures
Legacy Community Health Services Inc,Houston,TX,77006,760009637,AmeriCorps,Service & Volunteerism,Service & Volunteerism,Service and Volunteerism,Healthy Futures
Legal Aid Society of Hawaii,Honolulu,HI,96813,990076020,AmeriCorps,Service & Volunteerism,Service & Volunteerism,Service and Volunteerism,Economic Opportunity
"Legal Assistance of Western New York, Inc.",Geneva,NY,14456,160955954,AmeriCorps,Service & Volunteerism,Service & Volunteerism,Service and Volunteerism,Economic Opportunity
"Lessie Bates Davis Neighborhood House, Inc.",East Saint Louis,IL,62205,370662522,AmeriCorps,Service & Volunteerism,Service & Volunteerism,Service and Volunteerism,Capacity Building; Economic Opportunity; Education; Healthy Futures; Veterans and Military Families
Lewis County Seniors,Chehalis,WA,98532,911171354,AmeriCorps,Service & Volunteerism,Service & Volunteerism,Service and Volunteerism,Healthy Futures
Life & Discovery Inc,Frederick,MD,21701,861140556,AmeriCorps,Service & Volunteerism,Service & Volunteerism,Service and Volunteerism,Capacity Building; Economic Opportunity; Education; Healthy Futures
LifeLong Medical Care,Berkeley,CA,94710,942502308,AmeriCorps,Service & Volunteerism,Service & Volunteerism,Service and Volunteerism,Healthy Futures
Lifecycle Building Center,Atlanta,GA,30357,452645951,AmeriCorps,Service & Volunteerism,Service & Volunteerism,Service and Volunteerism,Capacity Building; Economic Opportunity
"Lifescape Community Services, Inc.",Rockford,IL,61101,363303361,AmeriCorps,Service & Volunteerism,Service & Volunteerism,Service and Volunteerism,Capacity Building; Economic Opportunity; Education; Environmental Stewardship; Healthy Futures
Lift Community Action Agency Inc,Hugo,OK,74743,730772321,AmeriCorps,Service & Volunteerism,Service & Volunteerism,Service and Volunteerism,Capacity Building; Healthy Futures
LiftFund Inc,San Antonio,TX,78207,742712770,AmeriCorps,Service & Volunteerism,Service & Volunteerism,Service and Volunteerism,Capacity Building; Economic Opportunity
Lilyfield Inc,Edmond,OK,73013,731597486,AmeriCorps,Service & Volunteerism,Service & Volunteerism,Service and Volunteerism,Education
Lincoln Hills Development Corporation,Tell City,IN,47586,351112746,AmeriCorps,Service & Volunteerism,Service & Volunteerism,Service and Volunteerism,Capacity Building; Healthy Futures
Lincoln University,Jefferson City,MO,65101,446001089,AmeriCorps,Service & Volunteerism,Service & Volunteerism,Service and Volunteerism,Capacity Building; Education
Literacy Coalition-South Central Arkansas,Camden,AR,71701,710702254,AmeriCorps,Service & Volunteerism,Service & Volunteerism,Service and Volunteerism,Capacity Building; Economic Opportunity; Education
Literacy Kansas City,Kansas City,MO,64109,431435729,AmeriCorps,Service & Volunteerism,Service & Volunteerism,Service and Volunteerism,Capacity Building; Economic Opportunity; Education; Environmental Stewardship; Healthy Futures
"Literacy Lab, The",Washington,DC,20036,271777117,AmeriCorps,Service & Volunteerism,Service & Volunteerism,Service and Volunteerism,Capacity Building; Economic Opportunity; Education
Literacy Mid-South,Memphis,TN,38104,620960143,AmeriCorps,Service & Volunteerism,Service & Volunteerism,Service and Volunteerism,Education
Literacy Minnesota,Saint Paul,MN,55114,411916004,AmeriCorps,Service & Volunteerism,Service & Volunteerism,Service and Volunteerism,Capacity Building; Economic Opportunity; Education
Literacy New Jersey Inc,Edison,NJ,08837,521146384,AmeriCorps,Service & Volunteerism,Service & Volunteerism,Service and Volunteerism,Economic Opportunity
Literacy Pittsburgh,Pittsburgh,PA,15219,251392652,AmeriCorps,Service & Volunteerism,Service & Volunteerism,Service and Volunteerism,Economic Opportunity; Education
Literacy Volunteers Of Illinois,Chicago,IL,60603,363244036,AmeriCorps,Service & Volunteerism,Service & Volunteerism,Service and Volunteerism,Economic Opportunity; Education
Little Iron Mom,Cedar Falls,IA,50613,822214679,AmeriCorps,Service & Volunteerism,Service & Volunteerism,Service and Volunteerism,Capacity Building; Economic Opportunity
"Little Rock, City Of",Little Rock,AR,72201,716014106,AmeriCorps,Service & Volunteerism,Service & Volunteerism,Service and Volunteerism,Capacity Building; Economic Opportunity; Education; Healthy Futures
Local Initiatives Support Corporation,New York,NY,10005,133030229,AmeriCorps,Service & Volunteerism,Service & Volunteerism,Service and Volunteerism,Capacity Building; Economic Opportunity
Local Redevelopment Authority for Roosevelt Roads,San Juan,PR,00918,660661048,AmeriCorps,Service & Volunteerism,Service & Volunteerism,Service and Volunteerism,Capacity Building; Economic Opportunity
Lone Star Association of Charitable Clinics Inc,Austin,TX,78705,331115138,AmeriCorps,Service & Volunteerism,Service & Volunteerism,Service and Volunteerism,Capacity Building; Healthy Futures
Lookout Mountain Conservancy,Lookout Mountain,TN,37350,621460535,AmeriCorps,Service & Volunteerism,Service & Volunteerism,Service and Volunteerism,Capacity Building; Education; Environmental Stewardship
Louisiana Delta Service Corps,Baton Rouge,LA,70802,721285695,AmeriCorps,Service & Volunteerism,Service & Volunteerism,Service and Volunteerism,Capacity Building
Louisiana Department of Veterans Affairs,Baton Rouge,LA,70806,726000840,AmeriCorps,Service & Volunteerism,Service & Volunteerism,Service and Volunteerism,Veterans and Military Families
Love Community Development Corp,Winston Salem,NC,27105,582463983,AmeriCorps,Service & Volunteerism,Service & Volunteerism,Service and Volunteerism,Capacity Building; Education; Healthy Futures
Loyola University Chicago Law School - HJP,Chicago,IL,60611,361408475,AmeriCorps,Service & Volunteerism,Service & Volunteerism,Service and Volunteerism,Capacity Building; Economic Opportunity; Healthy Futures
Luella Hannan Memorial Foundation,Detroit,MI,48201,381358386,AmeriCorps,Service & Volunteerism,Service & Volunteerism,Service and Volunteerism,Healthy Futures
Lutheran Community Services Northwest,Seatac,WA,98188,930386860,AmeriCorps,Service & Volunteerism,Service & Volunteerism,Service and Volunteerism,Capacity Building; Healthy Futures
Lutheran Social Service of Minnesota,Saint Paul,MN,55108,410872993,AmeriCorps,Service & Volunteerism,Service & Volunteerism,Service and Volunteerism,Education; Healthy Futures
Lutheran Social Services of Southern California,Orange,CA,92868,952225798,AmeriCorps,Service & Volunteerism,Service & Volunteerism,Service and Volunteerism,Healthy Futures
MAAC,Chula Vista,CA,91911,111111111,AmeriCorps,Service & Volunteerism,Service & Volunteerism,Service and Volunteerism,Urban/Rural Development
MAGGIES PLACE,Phoenix,AZ,85016,860972675,AmeriCorps,Service & Volunteerism,Service & Volunteerism,Service and Volunteerism,Economic Opportunity; Healthy Futures
MAHUBE-OTWA Community ACT PART,Detroit Lakes,MN,56501,416049474,AmeriCorps,Service & Volunteerism,Service & Volunteerism,Service and Volunteerism,Capacity Building; Economic Opportunity; Environmental Stewardship; Healthy Futures
MALDEN CHAMBER OF COMMERCE,Malden,MO,63863,430725614,AmeriCorps,Service & Volunteerism,Service & Volunteerism,Service and Volunteerism,Healthy Futures
"MARICOPA, COUNTY OF",Phoenix,AZ,85003,866000472,AmeriCorps,Service & Volunteerism,Service & Volunteerism,Service and Volunteerism,Economic Opportunity
MARQUETTE COUNTY,Marquette,MI,49855,386004869,AmeriCorps,Service & Volunteerism,Service & Volunteerism,Service and Volunteerism,Healthy Futures; Veterans and Military Families
MARSHFIELD CLINIC,Marshfield,WI,54449,390452970,AmeriCorps,Service & Volunteerism,Service & Volunteerism,Service and Volunteerism,Capacity Building; Healthy Futures
MARTHA O'BRYAN CENTER,Nashville,TN,37206,620477728,AmeriCorps,Service & Volunteerism,Service & Volunteerism,Service and Volunteerism,Capacity Building; Economic Opportunity; Education
"MASSACHUSETTS SERVICE ALLIANCE, INC",Boston,MA,02114,043088234,AmeriCorps,Service & Volunteerism,Service & Volunteerism,Service and Volunteerism,Capacity Building
"MCCJ, Inc.",Miami,FL,33131,203534284,AmeriCorps,Service & Volunteerism,Service & Volunteerism,Service and Volunteerism,Capacity Building; Economic Opportunity; Education; Healthy Futures
MCLENNAN COUNTY JUNIOR COLLEGE DISTRICT,Waco,TX,76708,741541260,AmeriCorps,Service & Volunteerism,Service & Volunteerism,Service and Volunteerism,Economic Opportunity; Healthy Futures; Veterans and Military Families
"MENTAL HEALTH AMERICA OF SOUTH CENTRAL KANSAS, INC",Wichita,KS,67208,480990763,AmeriCorps,Service & Volunteerism,Service & Volunteerism,Service and Volunteerism,Capacity Building; Education; Healthy Futures
MENTAL HEALTH COLLECTIVE,Minneapolis,MN,55408,411946275,AmeriCorps,Service & Volunteerism,Service & Volunteerism,Service and Volunteerism,Capacity Building; Healthy Futures
MIAMI UNIVERSITY,Oxford,OH,45056,316402089,AmeriCorps,Service & Volunteerism,Service & Volunteerism,Service and Volunteerism,Capacity Building; Education
MIAMI-DADE COUNTY,Miami,FL,33128,596000573,AmeriCorps,Service & Volunteerism,Service & Volunteerism,Service and Volunteerism,Disaster Services; Education; Healthy Futures; Veterans and Military Families
"MICHIGAN DEPARTMENT OF ENVIRONMENT, GREAT LAKES, AND ENERGY",Lansing,MI,48933,386000134,AmeriCorps,Service & Volunteerism,Service & Volunteerism,Service and Volunteerism,Capacity Building
MICHIGAN DEPARTMENT OF LABOR AND ECONOMIC OPPORTUNITY,Okemos,MI,48864,386000134,AmeriCorps,Service & Volunteerism,Service & Volunteerism,Service and Volunteerism,Capacity Building; Economic Opportunity
MISSISSIPPI COMMISSION FOR VOLUNTEER SERVICE,Jackson,MS,39211,646000783,AmeriCorps,Service & Volunteerism,Service & Volunteerism,Service and Volunteerism,Capacity Building
MISSISSIPPI URBAN LEAGUE INC,Jackson,MS,39213,274272183,AmeriCorps,Service & Volunteerism,Service & Volunteerism,Service and Volunteerism,Capacity Building; Healthy Futures
MOAB FREE HEALTH CLINIC,Moab,UT,84532,262082745,AmeriCorps,Service & Volunteerism,Service & Volunteerism,Service and Volunteerism,Capacity Building; Disaster Services; Economic Opportunity; Education; Environmental Stewardship
