Name,City,State,Zip,EIN,Source,Goals,Category of Work,Methods,Focus Areas
Porter-Leath,Memphis,TN,38118,581409385,AmeriCorps,Service & Volunteerism,Service & Volunteerism,Service and Volunteerism,Education
Porterville Unified School District,Porterville,CA,93257,770562920,AmeriCorps,Service & Volunteerism,Service & Volunteerism,Service and Volunteerism,Education
Portsmouth Naval Shipyard,Kittery,ME,03904,020222934,AmeriCorps,Service & Volunteerism,Service & Volunteerism,Service and Volunteerism,Capacity Building; Education
"Positive Maturity, Inc",Birmingham,AL,35209,630590338,AmeriCorps,Service & Volunteerism,Service & Volunteerism,Service and Volunteerism,Capacity Building; Education; Healthy Futures
"Powell Economic Partnership, Inc.",Powell,WY,82435,453122296,AmeriCorps,Service & Volunteerism,Service & Volunteerism,Service and Volunteerism,Capacity Building; Economic Opportunity; Education; Environmental Stewardship; Healthy Futures
Prairie Band Potawatomi Nation,Mayetta,KS,66509,480843973,AmeriCorps,Service & Volunteerism,Service & Volunteerism,Service and Volunteerism,Education
Prescott College Inc,Prescott,AZ,86301,860294012,AmeriCorps,Service & Volunteerism,Service & Volunteerism,Service and Volunteerism,Capacity Building; Economic Opportunity; Education; Healthy Futures
"Preservation Alliance of West Virginia, Inc.",Elkins,WV,26241,311028713,AmeriCorps,Service & Volunteerism,Service & Volunteerism,Service and Volunteerism,Capacity Building
Prince George's County Maryland,Largo,MD,20774,526000998,AmeriCorps,Service & Volunteerism,Service & Volunteerism,Service and Volunteerism,Education; Healthy Futures
Project New Village,San Diego,CA,92114,271306157,AmeriCorps,Service & Volunteerism,Service & Volunteerism,Service and Volunteerism,Capacity Building; Economic Opportunity; Healthy Futures
Project Transformation National,Dallas,TX,75225,474329954,AmeriCorps,Service & Volunteerism,Service & Volunteerism,Service and Volunteerism,Education
Project Transformation North Texas,Dallas,TX,75225,752930405,AmeriCorps,Service & Volunteerism,Service & Volunteerism,Service and Volunteerism,Capacity Building; Education
"Proyecto Juan Diego, Inc.",Brownsville,TX,78526,810606967,AmeriCorps,Service & Volunteerism,Service & Volunteerism,Service and Volunteerism,Capacity Building; Healthy Futures
Public Allies Inc,Milwaukee,WI,53204,521759564,AmeriCorps,Service & Volunteerism,Service & Volunteerism,Service and Volunteerism,Capacity Building
Public Health District No. 1,Hayden,ID,83835,826000952,AmeriCorps,Service & Volunteerism,Service & Volunteerism,Service and Volunteerism,Healthy Futures
Public Health Institute,Oakland,CA,94607,941646278,AmeriCorps,Service & Volunteerism,Service & Volunteerism,Service and Volunteerism,Capacity Building; Healthy Futures
Public Health Institute of Metropolitan Chicago,Chicago,IL,60601,363959353,AmeriCorps,Service & Volunteerism,Service & Volunteerism,Service and Volunteerism,Capacity Building; Education
Public Health Solutions,New York,NY,10013,135669201,AmeriCorps,Service & Volunteerism,Service & Volunteerism,Service and Volunteerism,Healthy Futures
"Public Health and Human Services, Montana Department of",Helena,MT,59601,810302402,AmeriCorps,Service & Volunteerism,Service & Volunteerism,Service and Volunteerism,Capacity Building; Economic Opportunity; Education; Healthy Futures
Pueblo of Zuni,Zuni,NM,87327,850156092,AmeriCorps,Service & Volunteerism,Service & Volunteerism,Service and Volunteerism,Education; Healthy Futures
Puerto Rico Youth At Risk Inc,San Juan,PR,00925,660491142,AmeriCorps,Service & Volunteerism,Service & Volunteerism,Service and Volunteerism,Capacity Building; Education
QUAD AREA COMMUNITY ACTION AGENCY INC,Hammond,LA,70401,720796570,AmeriCorps,Service & Volunteerism,Service & Volunteerism,Service and Volunteerism,Education
"READ USA, Inc.",Jacksonville,FL,32207,474729513,AmeriCorps,Service & Volunteerism,Service & Volunteerism,Service and Volunteerism,Capacity Building; Economic Opportunity; Education
"REBUILDING TOGETHER NEW ORLEANS, INC.",New Orleans,LA,70117,834047337,AmeriCorps,Service & Volunteerism,Service & Volunteerism,Service and Volunteerism,Economic Opportunity
"REBUILDING TOGETHER, INC.",Washington,DC,20002,521585880,AmeriCorps,Service & Volunteerism,Service & Volunteerism,Service and Volunteerism,Economic Opportunity; Veterans and Military Families
RED LAKE BAND OF CHIPPEWA INDIANS,Redlake,MN,56671,410692381,AmeriCorps,Service & Volunteerism,Service & Volunteerism,Service and Volunteerism,Education
REFILL JACKSON INITIATIVE,Jackson,MS,39203,820631249,AmeriCorps,Service & Volunteerism,Service & Volunteerism,Service and Volunteerism,Capacity Building; Economic Opportunity
REFUGEE & IMMIGRANT VOICES IN ACTION,Des Moines,IA,50310,461017191,AmeriCorps,Service & Volunteerism,Service & Volunteerism,Service and Volunteerism,Capacity Building; Economic Opportunity
REGION IV AREA AGENCY ON AGING INC,Saint Joseph,MI,49085,382332594,AmeriCorps,Service & Volunteerism,Service & Volunteerism,Service and Volunteerism,Education; Healthy Futures
RETIRED SENIOR VOLUNTEER PROGRAM,Eufaula,AL,36027,630653823,AmeriCorps,Service & Volunteerism,Service & Volunteerism,Service and Volunteerism,Healthy Futures
"RETIRED SENIOR VOLUNTEER PROGRAM OF ROCK COUNTY, INC.",Beloit,WI,53511,391587220,AmeriCorps,Service & Volunteerism,Service & Volunteerism,Service and Volunteerism,Education; Healthy Futures
RI DEPARTMENT OF ELEMENTARY AND SECONDARY EDUCATION,Providence,RI,02903,056000522,AmeriCorps,Service & Volunteerism,Service & Volunteerism,Service and Volunteerism,Capacity Building
"RICHMOND, CITY OF",Richmond,VA,23219,546001556,AmeriCorps,Service & Volunteerism,Service & Volunteerism,Service and Volunteerism,Economic Opportunity; Environmental Stewardship; Healthy Futures
"ROADRUNNER FOOD BANK, INC.",Albuquerque,NM,87109,850278525,AmeriCorps,Service & Volunteerism,Service & Volunteerism,Service and Volunteerism,Healthy Futures
ROWAN COLLEGE SOUTH JERSEY A NJ NONPROFIT CORPORATION,Sewell,NJ,08080,226088440,AmeriCorps,Service & Volunteerism,Service & Volunteerism,Service and Volunteerism,Healthy Futures
RSVP OF NORTHEAST KANSAS INC,Marysville,KS,66508,481225044,AmeriCorps,Service & Volunteerism,Service & Volunteerism,Service and Volunteerism,Economic Opportunity; Healthy Futures; Veterans and Military Families
RSVP VOLUNTEERS,King of Prussia,PA,19406,232121691,AmeriCorps,Service & Volunteerism,Service & Volunteerism,Service and Volunteerism,Capacity Building; Economic Opportunity; Education; Healthy Futures
"RSVP of Allen County, INC.",Fort Wayne,IN,46805,364559850,AmeriCorps,Service & Volunteerism,Service & Volunteerism,Service and Volunteerism,Capacity Building; Economic Opportunity; Healthy Futures
"RSVP of Central OK, Inc.",Midwest City,OK,73110,731076184,AmeriCorps,Service & Volunteerism,Service & Volunteerism,Service and Volunteerism,Capacity Building; Healthy Futures
RSVP of Dane County Inc,Madison,WI,53719,391273164,AmeriCorps,Service & Volunteerism,Service & Volunteerism,Service and Volunteerism,Education; Healthy Futures
RURAL ALASKA COMMUNITY ACTION PROGRAM INC,Anchorage,AK,99501,920033876,AmeriCorps,Service & Volunteerism,Service & Volunteerism,Service and Volunteerism,Capacity Building; Economic Opportunity; Education; Healthy Futures
"Racine Zoological Society, Inc.",Racine,WI,53402,396065035,AmeriCorps,Service & Volunteerism,Service & Volunteerism,Service and Volunteerism,Education; Environmental Stewardship
Rainbow Labs Mentoring Inc,West Hollywood,CA,90046,863680722,AmeriCorps,Service & Volunteerism,Service & Volunteerism,Service and Volunteerism,Capacity Building
Raising A Village Foundation,Washington,DC,20016,821828402,AmeriCorps,Service & Volunteerism,Service & Volunteerism,Service and Volunteerism,Capacity Building; Education
Re-Entry Solutions,Alexandria,LA,71301,272469652,AmeriCorps,Service & Volunteerism,Service & Volunteerism,Service and Volunteerism,Capacity Building; Economic Opportunity
ReDefiners World Languages Inc.,Tampa,FL,33617,811352382,AmeriCorps,Service & Volunteerism,Service & Volunteerism,Service and Volunteerism,Capacity Building; Education
"ReSOURCE: A Nonprofit Community Enterprise, Inc.",Williston,VT,05495,030326293,AmeriCorps,Service & Volunteerism,Service & Volunteerism,Service and Volunteerism,Economic Opportunity
Reach Out West End,Upland,CA,91786,952642747,AmeriCorps,Service & Volunteerism,Service & Volunteerism,Service and Volunteerism,Healthy Futures
"ReachBack, Inc.",Douglasville,GA,30135,833418756,AmeriCorps,Service & Volunteerism,Service & Volunteerism,Service and Volunteerism,Capacity Building; Economic Opportunity
"Reading & Math, Inc.",Minneapolis,MN,55415,472306902,AmeriCorps,Service & Volunteerism,Service & Volunteerism,Service and Volunteerism,Capacity Building; Economic Opportunity; Education; Healthy Futures
Reading ASSIST Institute,Wilmington,DE,19801,510317415,AmeriCorps,Service & Volunteerism,Service & Volunteerism,Service and Volunteerism,Education
Reading Is Fundamental,Washington,DC,20002,520976257,AmeriCorps,Service & Volunteerism,Service & Volunteerism,Service and Volunteerism,Capacity Building; Education
Reading Partners,Oakland,CA,94607,770568469,AmeriCorps,Service & Volunteerism,Service & Volunteerism,Service and Volunteerism,Capacity Building; Education
Real Services Inc,South Bend,IN,46601,351157606,AmeriCorps,Service & Volunteerism,Service & Volunteerism,Service and Volunteerism,Education
Rebuild Upstate,Greenville,SC,29601,208296408,AmeriCorps,Service & Volunteerism,Service & Volunteerism,Service and Volunteerism,Economic Opportunity; Veterans and Military Families
Rebuilding Together East Bay-North,Berkeley,CA,94710,943238591,AmeriCorps,Service & Volunteerism,Service & Volunteerism,Service and Volunteerism,Environmental Stewardship
Reconciliation Services,Kansas City,MO,64109,364580402,AmeriCorps,Service & Volunteerism,Service & Volunteerism,Service and Volunteerism,Education
"Recovery Idaho, Inc.",Meridian,ID,83642,471285545,AmeriCorps,Service & Volunteerism,Service & Volunteerism,Service and Volunteerism,Capacity Building; Healthy Futures
Rector & Visitors of the University of Virginia,Charlottesville,VA,22903,546001796,AmeriCorps,Service & Volunteerism,Service & Volunteerism,Service and Volunteerism,Education
"Red Cloud Indian School, Inc.",Pine Ridge,SD,57770,460275071,AmeriCorps,Service & Volunteerism,Service & Volunteerism,Service and Volunteerism,Education
"Red River Community Corps, Inc.",Oklahoma City,OK,73116,463341733,AmeriCorps,Service & Volunteerism,Service & Volunteerism,Service and Volunteerism,Capacity Building; Economic Opportunity; Education; Healthy Futures
Red River Valley Habitat for Humanity,Grand Forks,ND,58203,450407344,AmeriCorps,Service & Volunteerism,Service & Volunteerism,Service and Volunteerism,Capacity Building; Economic Opportunity
Redwood Parks Conservancy,Crescent City,CA,95531,680084901,AmeriCorps,Service & Volunteerism,Service & Volunteerism,Service and Volunteerism,Environmental Stewardship
"Regents of the University of California, The",Berkeley,CA,94710,946002123,AmeriCorps,Service & Volunteerism,Service & Volunteerism,Service and Volunteerism,Capacity Building
Regents of the University of Idaho,Moscow,ID,83844,826000945,AmeriCorps,Service & Volunteerism,Service & Volunteerism,Service and Volunteerism,Education
Regents of the University of Minnesota,Minneapolis,MN,55455,416007513,AmeriCorps,Service & Volunteerism,Service & Volunteerism,Service and Volunteerism,Healthy Futures
"Region 10 League for Economic Assistance and Planning, Inc.",Montrose,CO,81401,840631483,AmeriCorps,Service & Volunteerism,Service & Volunteerism,Service and Volunteerism,Economic Opportunity; Healthy Futures; Veterans and Military Families
Region 8 Planning & Development Council,Petersburg,WV,26847,550531062,AmeriCorps,Service & Volunteerism,Service & Volunteerism,Service and Volunteerism,Education
"Regional Youth/Adult Social Action Partnership, Inc.",Bridgeport,CT,06605,061357699,AmeriCorps,Service & Volunteerism,Service & Volunteerism,Service and Volunteerism,Capacity Building; Healthy Futures
Rehaciendo Comunidades Con Esperanza,San Juan,PR,00931,660245528,AmeriCorps,Service & Volunteerism,Service & Volunteerism,Service and Volunteerism,Capacity Building; Disaster Services
Relay Graduate School of Education,New York,NY,10004,275316628,AmeriCorps,Service & Volunteerism,Service & Volunteerism,Service and Volunteerism,Education
Rend Lake College,Ina,IL,62846,370899219,AmeriCorps,Service & Volunteerism,Service & Volunteerism,Service and Volunteerism,Education; Environmental Stewardship
"Renewal Unlimited, Inc.",Portage,WI,53901,391270955,AmeriCorps,Service & Volunteerism,Service & Volunteerism,Service and Volunteerism,Economic Opportunity
Repurposed Blooms,Hoover,AL,35244,831162875,AmeriCorps,Service & Volunteerism,Service & Volunteerism,Service and Volunteerism,Healthy Futures
Research Institute at Nationwide Children's Hospital Inc,Columbus,OH,43205,316056230,AmeriCorps,Service & Volunteerism,Service & Volunteerism,Service and Volunteerism,Economic Opportunity
Retired & Senior Volunteer Program Inc,Athens,AL,35611,631149675,AmeriCorps,Service & Volunteerism,Service & Volunteerism,Service and Volunteerism,Economic Opportunity; Education; Healthy Futures
"Retired & Senior Volunteer Program of Ingham, Eaton, and Clinton",Lansing,MI,48910,061731786,AmeriCorps,Service & Volunteerism,Service & Volunteerism,Service and Volunteerism,Disaster Services; Education; Environmental Stewardship; Healthy Futures
Retired Senior Volunteer Program,Bakersfield,CA,93301,952676423,AmeriCorps,Service & Volunteerism,Service & Volunteerism,Service and Volunteerism,Healthy Futures
Retired Senior Volunteer Program,Carroll,IA,51401,421039486,AmeriCorps,Service & Volunteerism,Service & Volunteerism,Service and Volunteerism,Capacity Building; Education; Healthy Futures
Retired Senior Volunteer Program Inc.,Washington,IN,47501,351760790,AmeriCorps,Service & Volunteerism,Service & Volunteerism,Service and Volunteerism,Capacity Building; Economic Opportunity; Education; Healthy Futures
"Rhode Island Free Clinic, inc., The",Providence,RI,02907,050501276,AmeriCorps,Service & Volunteerism,Service & Volunteerism,Service and Volunteerism,Capacity Building; Economic Opportunity; Healthy Futures
Rhode Island Hospital,Providence,RI,02903,050258954,AmeriCorps,Service & Volunteerism,Service & Volunteerism,Service and Volunteerism,Capacity Building; Healthy Futures
Richmond Promise,Richmond,CA,94804,811653085,AmeriCorps,Service & Volunteerism,Service & Volunteerism,Service and Volunteerism,Capacity Building; Economic Opportunity; Education
Ritter Center,San Rafael,CA,94901,942675517,AmeriCorps,Service & Volunteerism,Service & Volunteerism,Service and Volunteerism,Capacity Building; Healthy Futures
Riverside County Office on Aging,Riverside,CA,92506,956000930,AmeriCorps,Service & Volunteerism,Service & Volunteerism,Service and Volunteerism,Disaster Services; Healthy Futures
Roane County Anti-Drug Coalition,Kingston,TN,37763,200207066,AmeriCorps,Service & Volunteerism,Service & Volunteerism,Service and Volunteerism,Capacity Building; Healthy Futures
"Rocky Mountain Development Council, Inc",Helena,MT,59601,810296458,AmeriCorps,Service & Volunteerism,Service & Volunteerism,Service and Volunteerism,Capacity Building; Education; Healthy Futures
Rocky Mountain Youth Corps,Taos,NM,87571,850404817,AmeriCorps,Service & Volunteerism,Service & Volunteerism,Service and Volunteerism,Environmental Stewardship; Healthy Futures
Rogue Community Health,Medford,OR,97504,237366812,AmeriCorps,Service & Volunteerism,Service & Volunteerism,Service and Volunteerism,Capacity Building; Economic Opportunity
"Ronald McDonald House of New York, Inc",New York,NY,10021,132933654,AmeriCorps,Service & Volunteerism,Service & Volunteerism,Service and Volunteerism,Capacity Building
Root & Rebound,Oakland,CA,94612,463876220,AmeriCorps,Service & Volunteerism,Service & Volunteerism,Service and Volunteerism,Capacity Building; Economic Opportunity
Rosebud Economic Development Corp,Mission,SD,57555,460454387,AmeriCorps,Service & Volunteerism,Service & Volunteerism,Service and Volunteerism,Capacity Building; Economic Opportunity; Healthy Futures
"Rotary Club of Rock Valley, Foundation, Inc., The",Rock Valley,IA,51247,391902725,AmeriCorps,Service & Volunteerism,Service & Volunteerism,Service and Volunteerism,Education; Healthy Futures
Rural Action Inc,The Plains,OH,45780,311124220,AmeriCorps,Service & Volunteerism,Service & Volunteerism,Service and Volunteerism,Capacity Building; Environmental Stewardship; Healthy Futures
"Rural Appalachian Improvement League, Inc.",Mullens,WV,25882,550784597,AmeriCorps,Service & Volunteerism,Service & Volunteerism,Service and Volunteerism,Capacity Building; Economic Opportunity; Healthy Futures
Rural Communities Resource Center RCRC,Orosi,CA,93647,471779129,AmeriCorps,Service & Volunteerism,Service & Volunteerism,Service and Volunteerism,Capacity Building; Economic Opportunity
Rural Dynamics Inc,Great Falls,MT,59401,810303443,AmeriCorps,Service & Volunteerism,Service & Volunteerism,Service and Volunteerism,Capacity Building; Economic Opportunity; Education; Environmental Stewardship; Urban/Rural Development
"Rural Health Network of SCNY, Inc., The",Binghamton,NY,13904,223568461,AmeriCorps,Service & Volunteerism,Service & Volunteerism,Service and Volunteerism,Capacity Building; Healthy Futures
"Russellville, City of",Russellville,AL,35653,636001358,AmeriCorps,Service & Volunteerism,Service & Volunteerism,Service and Volunteerism,Education
"Rutgers, The State University",New Brunswick,NJ,08901,226001086,AmeriCorps,Service & Volunteerism,Service & Volunteerism,Service and Volunteerism,Environmental Stewardship
"Rutgers, the State University",Newark,NJ,07102,226001086,AmeriCorps,Service & Volunteerism,Service & Volunteerism,Service and Volunteerism,Education
"Rutgers, the State University of New Jersey N/A",Camden,NJ,08102,226001086,AmeriCorps,Service & Volunteerism,Service & Volunteerism,Service and Volunteerism,Capacity Building
"Rutland Community Programs, Inc.",Rutland,VT,05701,030307812,AmeriCorps,Service & Volunteerism,Service & Volunteerism,Service and Volunteerism,Economic Opportunity; Education; Healthy Futures
SAE International,Warrendale,PA,15086,251494402,AmeriCorps,Service & Volunteerism,Service & Volunteerism,Service and Volunteerism,Capacity Building
"SAGA Innovations, Inc.",Framingham,MA,01702,472168942,AmeriCorps,Service & Volunteerism,Service & Volunteerism,Service and Volunteerism,Education
"SALVATION ARMY, THE",West Nyack,NY,10994,135562351,AmeriCorps,Service & Volunteerism,Service & Volunteerism,Service and Volunteerism,Education; Healthy Futures
SAN PASQUAL BAND OF MISSION INDIANS,Valley Center,CA,92082,953469382,AmeriCorps,Service & Volunteerism,Service & Volunteerism,Service and Volunteerism,Education
SC UpLift Community Outreach,Columbia,SC,29203,261931708,AmeriCorps,Service & Volunteerism,Service & Volunteerism,Service and Volunteerism,Capacity Building; Economic Opportunity
SEED COALITION,Minneapolis,MN,55454,411996613,AmeriCorps,Service & Volunteerism,Service & Volunteerism,Service and Volunteerism,Capacity Building; Economic Opportunity; Education; Environmental Stewardship; Healthy Futures
SEEDS,Traverse City,MI,49684,383482266,AmeriCorps,Service & Volunteerism,Service & Volunteerism,Service and Volunteerism,Capacity Building; Economic Opportunity; Education; Environmental Stewardship; Healthy Futures
SENIOR ACTION INC,Greenville,SC,29615,570507961,AmeriCorps,Service & Volunteerism,Service & Volunteerism,Service and Volunteerism,Economic Opportunity; Healthy Futures
SENIOR CITIZENS INC,Nashville,TN,37203,620566419,AmeriCorps,Service & Volunteerism,Service & Volunteerism,Service and Volunteerism,Capacity Building; Education; Healthy Futures
"SENIOR SERVICES, INC.",Kalamazoo,MI,49001,381747660,AmeriCorps,Service & Volunteerism,Service & Volunteerism,Service and Volunteerism,Capacity Building; Economic Opportunity; Healthy Futures
SENIORS COUNCIL OF SANTA CRUZ AND SAN BENITO COUNTIES,Aptos,CA,95003,942662950,AmeriCorps,Service & Volunteerism,Service & Volunteerism,Service and Volunteerism,Education; Healthy Futures
SENIORS IN SERVICE,Sparks,NV,89431,942344734,AmeriCorps,Service & Volunteerism,Service & Volunteerism,Service and Volunteerism,Education; Healthy Futures
"SER DE NEW MEXICO, INC.",Los Lunas,NM,87031,850455314,AmeriCorps,Service & Volunteerism,Service & Volunteerism,Service and Volunteerism,Education
SERVE WYOMING,Casper,WY,82601,680556475,AmeriCorps,Service & Volunteerism,Service & Volunteerism,Service and Volunteerism,Capacity Building; Economic Opportunity; Education; Healthy Futures
SERVICEMEMBER AGRICULTURAL VOCATION EDUCATION CORP,Riley,KS,66531,810734441,AmeriCorps,Service & Volunteerism,Service & Volunteerism,Service and Volunteerism,Capacity Building; Veterans and Military Families
"SEWA INTERNATIONAL, INC.",Campbell,CA,95008,200638718,AmeriCorps,Service & Volunteerism,Service & Volunteerism,Service and Volunteerism,Capacity Building; Education; Healthy Futures
"SGA Youth & Family Services, NFP",Chicago,IL,60603,362167916,AmeriCorps,Service & Volunteerism,Service & Volunteerism,Service and Volunteerism,Education; Healthy Futures
SHARING EXCESS INC,Philadelphia,PA,19131,862161466,AmeriCorps,Service & Volunteerism,Service & Volunteerism,Service and Volunteerism,Capacity Building; Healthy Futures
SHEPHERDS CENTER OF KANSAS CITY CENTRAL,Kansas City,MO,64114,430994417,AmeriCorps,Service & Volunteerism,Service & Volunteerism,Service and Volunteerism,Healthy Futures
SHREVEPORT GREEN,Shreveport,LA,71104,720970610,AmeriCorps,Service & Volunteerism,Service & Volunteerism,Service and Volunteerism,Environmental Stewardship; Healthy Futures
"SIKESTON, CITY OF (INC)",Sikeston,MO,63801,431135757,AmeriCorps,Service & Volunteerism,Service & Volunteerism,Service and Volunteerism,Education
SITKA SCHOOL DISTRICT,Sitka,AK,99835,926000113,AmeriCorps,Service & Volunteerism,Service & Volunteerism,Service and Volunteerism,Education
"SIXTEENTH STREET COMMUNITY HEALTH CENTERS, INC.",Milwaukee,WI,53204,391180475,AmeriCorps,Service & Volunteerism,Service & Volunteerism,Service and Volunteerism,Healthy Futures
SOCIETY OF ST. VINCENT DE PAUL ARCHDIOCESAN COUNCIL OF NEW ORLEANS,New Orleans,LA,70119,720802053,AmeriCorps,Service & Volunteerism,Service & Volunteerism,Service and Volunteerism,Capacity Building; Healthy Futures
SOUTH AL REGIONAL PLAN COMMISSION,Mobile,AL,36602,630501382,AmeriCorps,Service & Volunteerism,Service & Volunteerism,Service and Volunteerism,Disaster Services; Economic Opportunity; Education; Healthy Futures; Veterans and Military Families
"SOUTHEAST MISSOURI AREA AGENCY ON AGING, INC.",Cape Girardeau,MO,63701,431020886,AmeriCorps,Service & Volunteerism,Service & Volunteerism,Service and Volunteerism,Capacity Building; Economic Opportunity; Healthy Futures
SOUTHEAST NEW MEXICO COMMUNITY ACTION CORP,Carlsbad,NM,88220,850196493,AmeriCorps,Service & Volunteerism,Service & Volunteerism,Service and Volunteerism,Education; Healthy Futures
SOUTHERN UNIVERSITY SHREVEPORT,Shreveport,LA,71107,726000817,AmeriCorps,Service & Volunteerism,Service & Volunteerism,Service and Volunteerism,Education
SPARKWHEEL INC,Lawrence,KS,66046,481175467,AmeriCorps,Service & Volunteerism,Service & Volunteerism,Service and Volunteerism,Capacity Building; Education
SPARTANBURG COUNTY SCHOOL DISTRICT NO. 7,Spartanburg,SC,29307,576000942,AmeriCorps,Service & Volunteerism,Service & Volunteerism,Service and Volunteerism,Education
SPECIAL OLYMPICS MICHIGAN INC,Grand Rapids,MI,49548,381964643,AmeriCorps,Service & Volunteerism,Service & Volunteerism,Service and Volunteerism,Healthy Futures
"ST LANDRY, PARISH OF",Opelousas,LA,70570,726001256,AmeriCorps,Service & Volunteerism,Service & Volunteerism,Service and Volunteerism,Healthy Futures
ST LOUIS BLACK REPERTORY,Saint Louis,MO,63130,431220180,AmeriCorps,Service & Volunteerism,Service & Volunteerism,Service and Volunteerism,Education
ST MARYS COUNTY DEPARTMENT OF AGING,Leonardtown,MD,20650,526001015,AmeriCorps,Service & Volunteerism,Service & Volunteerism,Service and Volunteerism,Healthy Futures
ST Martin Iberia Lafayette Community Action Agency INC,Lafayette,LA,70501,720648848,AmeriCorps,Service & Volunteerism,Service & Volunteerism,Service and Volunteerism,Disaster Services; Economic Opportunity; Healthy Futures; Veterans and Military Families
"ST. BERNARD PROJECT, INC., THE",New Orleans,LA,70119,262189665,AmeriCorps,Service & Volunteerism,Service & Volunteerism,Service and Volunteerism,Disaster Services
STATE OF KANSAS,Topeka,KS,66604,481124839,AmeriCorps,Service & Volunteerism,Service & Volunteerism,Service and Volunteerism,Education; Healthy Futures
STATE OF MARYLAND,Crownsville,MD,21032,526002033,AmeriCorps,Service & Volunteerism,Service & Volunteerism,Service and Volunteerism,Capacity Building
STATE OF MARYLAND EXECUTIVE OFFICE,Crownsville,MD,21032,526002033,AmeriCorps,Service & Volunteerism,Service & Volunteerism,Service and Volunteerism,Capacity Building
STATE OF MD,Frostburg,MD,21532,526002033,AmeriCorps,Service & Volunteerism,Service & Volunteerism,Service and Volunteerism,Capacity Building
STATE OF WASHINGTON,Lacey,WA,98503,916001063,AmeriCorps,Service & Volunteerism,Service & Volunteerism,Service and Volunteerism,Disaster Services; Environmental Stewardship
"STATE, NEW JERSEY DEPARTMENT OF",Trenton,NJ,08608,216000928,AmeriCorps,Service & Volunteerism,Service & Volunteerism,Service and Volunteerism,Capacity Building
STEP BY STEP INC,Charleston,WV,25301,550746556,AmeriCorps,Service & Volunteerism,Service & Volunteerism,Service and Volunteerism,Capacity Building; Healthy Futures
