Name,City,State,Zip,EIN,Source,Goals,Category of Work,Methods,Focus Areas
 City of Plainview,Plainview,TX,79072,756000639,AmeriCorps,Service & Volunteerism,Service & Volunteerism,Service and Volunteerism,Healthy Futures
 ERAS SENIOR NETWORK INC,Waukesha,WI,53188,391393171,AmeriCorps,Service & Volunteerism,Service & Volunteerism,Service and Volunteerism,Education; Healthy Futures
 Ohio Department of Natural Resources,Columbus,OH,43229,311334820,AmeriCorps,Service & Volunteerism,Service & Volunteerism,Service and Volunteerism,Environmental Stewardship
(This One) Idaho State University,Pocatello,ID,83201,826000924,AmeriCorps,Service & Volunteerism,Service & Volunteerism,Service and Volunteerism,Capacity Building; Healthy Futures
18 Reasons,San Francisco,CA,94110,453059509,AmeriCorps,Service & Volunteerism,Service & Volunteerism,Service and Volunteerism,Capacity Building; Healthy Futures
"826 Boston, Inc.",Roxbury,MA,02119,208065915,AmeriCorps,Service & Volunteerism,Service & Volunteerism,Service and Volunteerism,Education
826LA,Los Angeles,CA,90026,383722092,AmeriCorps,Service & Volunteerism,Service & Volunteerism,Service and Volunteerism,Capacity Building
916 Ink,Sacramento,CA,95824,460705510,AmeriCorps,Service & Volunteerism,Service & Volunteerism,Service and Volunteerism,Education
"A Million Stars, Inc.",Saint Louis,MO,63103,204768985,AmeriCorps,Service & Volunteerism,Service & Volunteerism,Service and Volunteerism,Education
A SAFE HAVEN FOUNDATION,Chicago,IL,60608,364444200,AmeriCorps,Service & Volunteerism,Service & Volunteerism,Service and Volunteerism,Capacity Building; Healthy Futures
A.C.E. OF SOUTHWEST MINNESOTA,Slayton,MN,56172,411242095,AmeriCorps,Service & Volunteerism,Service & Volunteerism,Service and Volunteerism,Capacity Building; Economic Opportunity; Healthy Futures; Veterans and Military Families
AARP Foundation,Washington,DC,20049,520794300,AmeriCorps,Service & Volunteerism,Service & Volunteerism,Service and Volunteerism,Capacity Building; Education
AB Christian Learning Center,Fort Worth,TX,76112,270141151,AmeriCorps,Service & Volunteerism,Service & Volunteerism,Service and Volunteerism,Capacity Building; Economic Opportunity; Education
ACCEL,Phoenix,AZ,85051,953497070,AmeriCorps,Service & Volunteerism,Service & Volunteerism,Service and Volunteerism,Economic Opportunity; Education
ACOMERPR Corporation,Mayaguez,PR,00680,660944244,AmeriCorps,Service & Volunteerism,Service & Volunteerism,Service and Volunteerism,Capacity Building; Economic Opportunity; Healthy Futures
"ACTION FOR BOSTON COMMUNITY DEVELOPMENT, INC",Boston,MA,02111,042304133,AmeriCorps,Service & Volunteerism,Service & Volunteerism,Service and Volunteerism,Education
ACTION RESOURCES INTERNATIONAL,Laramie,WY,82072,841296410,AmeriCorps,Service & Volunteerism,Service & Volunteerism,Service and Volunteerism,Capacity Building; Economic Opportunity; Education; Healthy Futures
"ADAMS, COUNTY OF",Brighton,CO,80601,846000732,AmeriCorps,Service & Volunteerism,Service & Volunteerism,Service and Volunteerism,Capacity Building; Economic Opportunity; Healthy Futures
"ADMINISTRATION, ALASKA DEPARTMENT OF",Juneau,AK,99801,926001185,AmeriCorps,Service & Volunteerism,Service & Volunteerism,Service and Volunteerism,Healthy Futures
"ADMINISTRATION, WISCONSIN DEPARTMENT OF",Madison,WI,53703,396028867,AmeriCorps,Service & Volunteerism,Service & Volunteerism,Service and Volunteerism,Capacity Building
"ADMINISTRATORS OF THE TULANE EDUCATIONAL FUND, THE",New Orleans,LA,70118,720423889,AmeriCorps,Service & Volunteerism,Service & Volunteerism,Service and Volunteerism,Capacity Building; Economic Opportunity; Education; Environmental Stewardship; Healthy Futures; Veterans and Military Families
ADVOCAP Inc,Fond Du Lac,WI,54935,391053365,AmeriCorps,Service & Volunteerism,Service & Volunteerism,Service and Volunteerism,Capacity Building; Education; Healthy Futures
AFTER-SCHOOL ALL-STARS,Los Angeles,CA,90048,954441208,AmeriCorps,Service & Volunteerism,Service & Volunteerism,Service and Volunteerism,Capacity Building; Economic Opportunity; Education
"AGENCY ON AGING OF SOUTH CENTRAL CONNECTICUT, INC",North Haven,CT,06473,060915531,AmeriCorps,Service & Volunteerism,Service & Volunteerism,Service and Volunteerism,Capacity Building; Education; Healthy Futures
AGING AND COMMUNITY SERVICES OF SOUTH CENTRAL INDIANA INC,Columbus,IN,47201,311017271,AmeriCorps,Service & Volunteerism,Service & Volunteerism,Service and Volunteerism,Education
"AGRICULTURE, CONSERVATION & FORESTRY, MAINE DEPARTMENT OF",Augusta,ME,04333,016000001,AmeriCorps,Service & Volunteerism,Service & Volunteerism,Service and Volunteerism,Capacity Building; Environmental Stewardship; Healthy Futures
ALASKA DEPARTMENT OF COMMERCE COMMUNITY & ECONOMIC DEVELOPMENT,Anchorage,AK,99501,926001185,AmeriCorps,Service & Volunteerism,Service & Volunteerism,Service and Volunteerism,Capacity Building
ALPINE ACHIEVERS INITIATIVE,Alamosa,CO,81101,811469355,AmeriCorps,Service & Volunteerism,Service & Volunteerism,Service and Volunteerism,Education
ALU LIKE Inc.,Honolulu,HI,96819,510151095,AmeriCorps,Service & Volunteerism,Service & Volunteerism,Service and Volunteerism,Education
AMERICORPS SENIORS/RSVP,Adamsville,TN,38310,620930682,AmeriCorps,Service & Volunteerism,Service & Volunteerism,Service and Volunteerism,Capacity Building; Healthy Futures
ANDREW COUNTY MINISTRIES INC,Savannah,MO,64485,431136856,AmeriCorps,Service & Volunteerism,Service & Volunteerism,Service and Volunteerism,Healthy Futures
"ANIZ, INC.",Atlanta,GA,30303,582272426,AmeriCorps,Service & Volunteerism,Service & Volunteerism,Service and Volunteerism,Capacity Building; Healthy Futures
ARC JACKSONVILLE INC,Jacksonville,FL,32209,596209603,AmeriCorps,Service & Volunteerism,Service & Volunteerism,Service and Volunteerism,Capacity Building; Economic Opportunity; Healthy Futures
"ARC OF PALM BEACH COUNTY, INC., THE",Riviera Beach,FL,33404,590883386,AmeriCorps,Service & Volunteerism,Service & Volunteerism,Service and Volunteerism,Economic Opportunity; Healthy Futures
AREA 10 AGENCY,Ellettsville,IN,47429,310955307,AmeriCorps,Service & Volunteerism,Service & Volunteerism,Service and Volunteerism,Capacity Building; Economic Opportunity; Healthy Futures
AREA AGENCY ON AGING FOR,Towanda,PA,18848,271773562,AmeriCorps,Service & Volunteerism,Service & Volunteerism,Service and Volunteerism,Education; Healthy Futures
AROOSTOOK AREA AGENCY ON AGING INC,Presque Isle,ME,04769,010322531,AmeriCorps,Service & Volunteerism,Service & Volunteerism,Service and Volunteerism,Capacity Building; Economic Opportunity; Healthy Futures
ARcare,Augusta,AR,72006,581666179,AmeriCorps,Service & Volunteerism,Service & Volunteerism,Service and Volunteerism,Education; Healthy Futures
AUSTIN ACHIEVE PUBLIC SCHOOLS,Austin,TX,78723,273700807,AmeriCorps,Service & Volunteerism,Service & Volunteerism,Service and Volunteerism,Education
"AUSTIN, CITY OF",Austin,TX,78744,746000085,AmeriCorps,Service & Volunteerism,Service & Volunteerism,Service and Volunteerism,Capacity Building; Disaster Services; Economic Opportunity; Education; Environmental Stewardship; Healthy Futures
Able South Carolina,Columbia,SC,29210,582336332,AmeriCorps,Service & Volunteerism,Service & Volunteerism,Service and Volunteerism,Economic Opportunity
Above and Beyond Family Recovery Center,Chicago,IL,60612,473675424,AmeriCorps,Service & Volunteerism,Service & Volunteerism,Service and Volunteerism,Capacity Building; Healthy Futures
Academy for Urban School Leadership,Chicago,IL,60634,364447457,AmeriCorps,Service & Volunteerism,Service & Volunteerism,Service and Volunteerism,Education
"Achievement First, Inc.",New Haven,CT,06513,651203744,AmeriCorps,Service & Volunteerism,Service & Volunteerism,Service and Volunteerism,Capacity Building; Education
"Action For Eastern Montana, Inc",Glendive,MT,59330,810297418,AmeriCorps,Service & Volunteerism,Service & Volunteerism,Service and Volunteerism,Healthy Futures
"Adult Learning Alliance, Inc.",Little Rock,AR,72201,710690604,AmeriCorps,Service & Volunteerism,Service & Volunteerism,Service and Volunteerism,Economic Opportunity
Affordable Living for the Aging,West Hollywood,CA,90046,953301874,AmeriCorps,Service & Volunteerism,Service & Volunteerism,Service and Volunteerism,Capacity Building
After Military Service,Houston,TX,77003,822280328,AmeriCorps,Service & Volunteerism,Service & Volunteerism,Service and Volunteerism,Capacity Building; Veterans and Military Families
"Age Well, Inc.",Colchester,VT,05446,222474636,AmeriCorps,Service & Volunteerism,Service & Volunteerism,Service and Volunteerism,Healthy Futures
AgingNext Inc,Claremont,CA,91711,953100466,AmeriCorps,Service & Volunteerism,Service & Volunteerism,Service and Volunteerism,Healthy Futures
"Agriculture, Montana Department of",Helena,MT,59601,810302402,AmeriCorps,Service & Volunteerism,Service & Volunteerism,Service and Volunteerism,Capacity Building; Environmental Stewardship
"Aiken/Barnwell Counties Community Action Agency, Inc.",Aiken,SC,29801,570476234,AmeriCorps,Service & Volunteerism,Service & Volunteerism,Service and Volunteerism,Education
Akron Summit Comm Action,Akron,OH,44308,340965339,AmeriCorps,Service & Volunteerism,Service & Volunteerism,Service and Volunteerism,Education
Alabama A&M University,Normal,AL,35762,636001097,AmeriCorps,Service & Volunteerism,Service & Volunteerism,Service and Volunteerism,Capacity Building
Alabama Association of Habitat Affiliates (AAHA),Auburn,AL,36831,631140499,AmeriCorps,Service & Volunteerism,Service & Volunteerism,Service and Volunteerism,Capacity Building; Economic Opportunity
Alabama Commission on Higher Education,Montgomery,AL,36104,636000619,AmeriCorps,Service & Volunteerism,Service & Volunteerism,Service and Volunteerism,Education
Alabama Rural Ministry,Auburn,AL,36831,631282477,AmeriCorps,Service & Volunteerism,Service & Volunteerism,Service and Volunteerism,Capacity Building; Economic Opportunity
Alabama State University,Montgomery,AL,36104,636001101,AmeriCorps,Service & Volunteerism,Service & Volunteerism,Service and Volunteerism,Capacity Building; Education; Healthy Futures
Alamo Area Council of Governments,San Antonio,TX,78217,741557491,AmeriCorps,Service & Volunteerism,Service & Volunteerism,Service and Volunteerism,Education; Healthy Futures
Alaska Children's Trust,Anchorage,AK,99503,911765129,AmeriCorps,Service & Volunteerism,Service & Volunteerism,Service and Volunteerism,Education
Alaska Pacific University,Anchorage,AK,99508,920023588,AmeriCorps,Service & Volunteerism,Service & Volunteerism,Service and Volunteerism,Healthy Futures
Albion College,Albion,MI,49224,381359081,AmeriCorps,Service & Volunteerism,Service & Volunteerism,Service and Volunteerism,Capacity Building; Education
"Aleutian Pribilof Islands Association, Inc.",Anchorage,AK,99518,920073013,AmeriCorps,Service & Volunteerism,Service & Volunteerism,Service and Volunteerism,Capacity Building; Healthy Futures
"Alexandria Tutoring Consortium, Inc.",Alexandria,VA,22314,562542869,AmeriCorps,Service & Volunteerism,Service & Volunteerism,Service and Volunteerism,Education
Alianza Municipal de Servicios Integrados Inc.,Caguas,PR,00725,660475971,AmeriCorps,Service & Volunteerism,Service & Volunteerism,Service and Volunteerism,Economic Opportunity; Healthy Futures
Align9,Kingston,TN,37763,823897134,AmeriCorps,Service & Volunteerism,Service & Volunteerism,Service and Volunteerism,Capacity Building; Economic Opportunity; Healthy Futures
"All Chicago Making Homelessness History - Chicago, IL",Chicago,IL,60661,364272272,AmeriCorps,Service & Volunteerism,Service & Volunteerism,Service and Volunteerism,Capacity Building
"Allegany County Human Resources Development Commission, Inc.",Cumberland,MD,21502,526065754,AmeriCorps,Service & Volunteerism,Service & Volunteerism,Service and Volunteerism,Healthy Futures; Veterans and Military Families
Allegheny College,Meadville,PA,16335,250965212,AmeriCorps,Service & Volunteerism,Service & Volunteerism,Service and Volunteerism,Capacity Building; Economic Opportunity; Education; Healthy Futures
"Allegheny, County of",Pittsburgh,PA,15219,256001017,AmeriCorps,Service & Volunteerism,Service & Volunteerism,Service and Volunteerism,Education; Healthy Futures
Alliance for Multicultural Community Services (AMCS),Houston,TX,77081,760171217,AmeriCorps,Service & Volunteerism,Service & Volunteerism,Service and Volunteerism,Capacity Building; Economic Opportunity
Alliance of Border Collaboratives (ABC),El Paso,TX,79905,271747560,AmeriCorps,Service & Volunteerism,Service & Volunteerism,Service and Volunteerism,Capacity Building; Healthy Futures
Alma College,Alma,MI,48801,381359083,AmeriCorps,Service & Volunteerism,Service & Volunteerism,Service and Volunteerism,Capacity Building; Education; Healthy Futures
Alvernia University,Reading,PA,19607,231522643,AmeriCorps,Service & Volunteerism,Service & Volunteerism,Service and Volunteerism,Education
Amarillo Independent School District,Amarillo,TX,79106,756000036,AmeriCorps,Service & Volunteerism,Service & Volunteerism,Service and Volunteerism,Education
American Conservation Experience,Flagstaff,AZ,86001,371473291,AmeriCorps,Service & Volunteerism,Service & Volunteerism,Service and Volunteerism,Environmental Stewardship
"American Heart Association, Inc.",Dallas,TX,75231,135613797,AmeriCorps,Service & Volunteerism,Service & Volunteerism,Service and Volunteerism,Healthy Futures
American Home Finding Association,Ottumwa,IA,52501,420713654,AmeriCorps,Service & Volunteerism,Service & Volunteerism,Service and Volunteerism,Education; Healthy Futures
"American National Red Cross, The",Washington,DC,20006,530196605,AmeriCorps,Service & Volunteerism,Service & Volunteerism,Service and Volunteerism,Capacity Building; Disaster Services; Economic Opportunity; Healthy Futures
American River Parkway Foundation,Carmichael,CA,95608,942881344,AmeriCorps,Service & Volunteerism,Service & Volunteerism,Service and Volunteerism,Environment
American YouthWorks,Austin,TX,78741,742197942,AmeriCorps,Service & Volunteerism,Service & Volunteerism,Service and Volunteerism,Disaster Services; Environmental Stewardship; Healthy Futures
"Americas for the Arts, Inc (DBA Americas for Conservation and the Arts)",Boulder,CO,80302,320261204,AmeriCorps,Service & Volunteerism,Service & Volunteerism,Service and Volunteerism,Capacity Building; Economic Opportunity
Amigos de las Americas,Houston,TX,77098,741547146,AmeriCorps,Service & Volunteerism,Service & Volunteerism,Service and Volunteerism,Capacity Building; Education
"Anderson Interfaith Ministries, Inc",Anderson,SC,29624,570896524,AmeriCorps,Service & Volunteerism,Service & Volunteerism,Service and Volunteerism,Capacity Building; Economic Opportunity; Education; Healthy Futures
Antioch University,Keene,NH,03431,310536640,AmeriCorps,Service & Volunteerism,Service & Volunteerism,Service and Volunteerism,Capacity Building; Economic Opportunity; Education
Appalachia Intermediate Unit 8,Altoona,PA,16602,251215721,AmeriCorps,Service & Volunteerism,Service & Volunteerism,Service and Volunteerism,Education; Environmental Stewardship; Healthy Futures
Appalachian Community Action & Dev Agency Inc,Gate City,VA,24251,540785849,AmeriCorps,Service & Volunteerism,Service & Volunteerism,Service and Volunteerism,Capacity Building; Economic Opportunity; Healthy Futures
"Appalachian Forest Heritage Area, Inc",Elkins,WV,26241,200815517,AmeriCorps,Service & Volunteerism,Service & Volunteerism,Service and Volunteerism,Capacity Building; Environmental Stewardship
"Appalachian Regional Coalition on Homelessness, The",Johnson City,TN,37604,300224760,AmeriCorps,Service & Volunteerism,Service & Volunteerism,Service and Volunteerism,Economic Opportunity
Appalachian State University,Boone,NC,28608,561176030,AmeriCorps,Service & Volunteerism,Service & Volunteerism,Service and Volunteerism,Capacity Building; Education; Healthy Futures
Appalachian Sustainable Development,Duffield,VA,24244,311445533,AmeriCorps,Service & Volunteerism,Service & Volunteerism,Service and Volunteerism,Capacity Building; Healthy Futures
"Apple Patch Community, Inc.",Crestwood,KY,40014,611159539,AmeriCorps,Service & Volunteerism,Service & Volunteerism,Service and Volunteerism,Capacity Building; Economic Opportunity
Applied Information Management Institute,Omaha,NE,68102,470749200,AmeriCorps,Service & Volunteerism,Service & Volunteerism,Service and Volunteerism,Economic Opportunity
"Area Agency On Aging Of Palm Beach/Treasure Coast, Inc.",West Palm Beach,FL,33407,650087858,AmeriCorps,Service & Volunteerism,Service & Volunteerism,Service and Volunteerism,Education
"Area Agency on Aging of Central Florida, Inc.",Orlando,FL,32803,593144723,AmeriCorps,Service & Volunteerism,Service & Volunteerism,Service and Volunteerism,Healthy Futures
Area Agency on Aging of West Central Arkansas INC,Hot Springs,AR,71913,710521904,AmeriCorps,Service & Volunteerism,Service & Volunteerism,Service and Volunteerism,Healthy Futures
"Area Agency on Aging, Region One, Inc",Phoenix,AZ,85014,742371957,AmeriCorps,Service & Volunteerism,Service & Volunteerism,Service and Volunteerism,Healthy Futures
Area Office on Aging of Northwestern Ohio Inc.,Toledo,OH,43609,341310295,AmeriCorps,Service & Volunteerism,Service & Volunteerism,Service and Volunteerism,Environmental Stewardship; Healthy Futures
"Arizona Caregiver Coalition, Inc.",Phoenix,AZ,85007,465295415,AmeriCorps,Service & Volunteerism,Service & Volunteerism,Service and Volunteerism,Healthy Futures
Arizona Corporation Commission,Phoenix,AZ,85007,866004791,AmeriCorps,Service & Volunteerism,Service & Volunteerism,Service and Volunteerism,Economic Opportunity
Arizona Food Bank Network,Phoenix,AZ,85004,860507679,AmeriCorps,Service & Volunteerism,Service & Volunteerism,Service and Volunteerism,Capacity Building; Healthy Futures
Arizona State University,Tempe,AZ,85281,860196696,AmeriCorps,Service & Volunteerism,Service & Volunteerism,Service and Volunteerism,Capacity Building; Economic Opportunity; Education; Healthy Futures; Veterans and Military Families
Arkansas Resource Conservation and Development Council,Roland,AR,72135,581755744,AmeriCorps,Service & Volunteerism,Service & Volunteerism,Service and Volunteerism,Healthy Futures
Arkansas State University,Jonesboro,AR,72401,716000556,AmeriCorps,Service & Volunteerism,Service & Volunteerism,Service and Volunteerism,Education
Arrowhead Economic Opportunity Agency Inc,Virginia,MN,55792,416052144,AmeriCorps,Service & Volunteerism,Service & Volunteerism,Service and Volunteerism,Healthy Futures
ArtistYear,Philadelphia,PA,19127,811281053,AmeriCorps,Service & Volunteerism,Service & Volunteerism,Service and Volunteerism,Education
Asbury Park City School District,Asbury Park,NJ,07712,216000111,AmeriCorps,Service & Volunteerism,Service & Volunteerism,Service and Volunteerism,Education
Ascencia,Glendale,CA,91204,204233822,AmeriCorps,Service & Volunteerism,Service & Volunteerism,Service and Volunteerism,Capacity Building; Economic Opportunity; Education
Ashtabula County Community Action Agency,Ashtabula,OH,44005,341059824,AmeriCorps,Service & Volunteerism,Service & Volunteerism,Service and Volunteerism,Capacity Building; Economic Opportunity
Asociacion Pro Juventud,Catano,PR,00962,660406990,AmeriCorps,Service & Volunteerism,Service & Volunteerism,Service and Volunteerism,Disaster Services; Economic Opportunity; Education; Healthy Futures
Aspire P16 Collaborative,Springfield,OH,45505,331147753,AmeriCorps,Service & Volunteerism,Service & Volunteerism,Service and Volunteerism,Capacity Building; Education; Healthy Futures
Aspire! Afterschool Learning,Arlington,VA,22204,541705642,AmeriCorps,Service & Volunteerism,Service & Volunteerism,Service and Volunteerism,Education
Association House of Chicago,Chicago,IL,60651,362166961,AmeriCorps,Service & Volunteerism,Service & Volunteerism,Service and Volunteerism,Economic Opportunity; Education; Healthy Futures
Association for Utah Community Health,Salt Lake City,UT,84107,870430946,AmeriCorps,Service & Volunteerism,Service & Volunteerism,Service and Volunteerism,Capacity Building; Healthy Futures
"Association of State and Territorial Chronic Disease Program Directors, Inc.",Decatur,GA,30030,731328414,AmeriCorps,Service & Volunteerism,Service & Volunteerism,Service and Volunteerism,Capacity Building
"Athens Community Council on Aging, Inc.",Athens,GA,30601,580977680,AmeriCorps,Service & Volunteerism,Service & Volunteerism,Service and Volunteerism,Education; Healthy Futures
Atlanta Regional Commission,Atlanta,GA,30303,586002324,AmeriCorps,Service & Volunteerism,Service & Volunteerism,Service and Volunteerism,Capacity Building; Healthy Futures
"Attorney General, Office of the",Olympia,WA,98504,916001060,AmeriCorps,Service & Volunteerism,Service & Volunteerism,Service and Volunteerism,Capacity Building; Veterans and Military Families
Auburn University,Auburn,AL,36849,636000724,AmeriCorps,Service & Volunteerism,Service & Volunteerism,Service and Volunteerism,Capacity Building; Education; Healthy Futures
"Audubon Area Community Services, Inc.",Owensboro,KY,42301,237364935,AmeriCorps,Service & Volunteerism,Service & Volunteerism,Service and Volunteerism,Capacity Building; Economic Opportunity; Education; Healthy Futures; Veterans and Military Families
Augsburg University,Minneapolis,MN,55454,410694721,AmeriCorps,Service & Volunteerism,Service & Volunteerism,Service and Volunteerism,Capacity Building
Ausable Valley Central School District,Clintonville,NY,12924,141505002,AmeriCorps,Service & Volunteerism,Service & Volunteerism,Service and Volunteerism,Capacity Building; Disaster Services; Education; Healthy Futures
Austin Creative Reuse,Austin,TX,78723,271275644,AmeriCorps,Service & Volunteerism,Service & Volunteerism,Service and Volunteerism,Capacity Building; Education; Environmental Stewardship
Austin Peay State University,Clarksville,TN,37044,620646576,AmeriCorps,Service & Volunteerism,Service & Volunteerism,Service and Volunteerism,Capacity Building; Environmental Stewardship; Healthy Futures
"AxessPointe Community Health Center, Inc.",Ravenna,OH,44266,341735884,AmeriCorps,Service & Volunteerism,Service & Volunteerism,Service and Volunteerism,Capacity Building; Education; Healthy Futures
BALTIMORE CITY HEALTH DEPARTMENT,Baltimore,MD,21202,526000769,AmeriCorps,Service & Volunteerism,Service & Volunteerism,Service and Volunteerism,Healthy Futures
BALTIMORE COUNTY MARYLAND,Towson,MD,21204,526000889,AmeriCorps,Service & Volunteerism,Service & Volunteerism,Service and Volunteerism,Healthy Futures
"BAY AREA COMMUNITY RESOURCES, INC.",San Rafael,CA,94903,942346815,AmeriCorps,Service & Volunteerism,Service & Volunteerism,Service and Volunteerism,Disaster Services; Education; Environmental Stewardship
BENS Connects Community Development Corporation,Birmingham,AL,35203,811002589,AmeriCorps,Service & Volunteerism,Service & Volunteerism,Service and Volunteerism,Capacity Building; Disaster Services; Healthy Futures
BIG BROTHERS BIG SISTERS OF S W LOUISIANA,Lake Charles,LA,70607,721009565,AmeriCorps,Service & Volunteerism,Service & Volunteerism,Service and Volunteerism,Education
"BIG BROTHERS BIG SISTERS OF ST. LUCIE, INDIAN RIVER & OKEECHOBEE COUNTIES, INC",Fort Pierce,FL,34950,592455513,AmeriCorps,Service & Volunteerism,Service & Volunteerism,Service and Volunteerism,Education
BLAIR SENIOR SERVICES INC,Altoona,PA,16601,251259406,AmeriCorps,Service & Volunteerism,Service & Volunteerism,Service and Volunteerism,Education; Healthy Futures
"BLUE GRASS COMMUNITY ACTION PARTNERSHIP, INC.",Frankfort,KY,40601,610659583,AmeriCorps,Service & Volunteerism,Service & Volunteerism,Service and Volunteerism,Healthy Futures
BLUEPRINTS,Washington,PA,15301,251153028,AmeriCorps,Service & Volunteerism,Service & Volunteerism,Service and Volunteerism,Economic Opportunity; Healthy Futures
BOARD OF REGENTS OF THE NEVADA SYSTEM OF HIGHER ED,Reno,NV,89557,886000024,AmeriCorps,Service & Volunteerism,Service & Volunteerism,Service and Volunteerism,Capacity Building; Education; Healthy Futures
BOSTON MEDICAL CENTER CORPORATION,Boston,MA,02118,043314093,AmeriCorps,Service & Volunteerism,Service & Volunteerism,Service and Volunteerism,Capacity Building; Economic Opportunity; Education; Healthy Futures
BOSTON MEDICAL CENTER CORPORATION Account 2,Boston,MA,02118,043314093,AmeriCorps,Service & Volunteerism,Service & Volunteerism,Service and Volunteerism,Healthy Futures
"BOSTON, CITY OF",Boston,MA,02201,046001380,AmeriCorps,Service & Volunteerism,Service & Volunteerism,Service and Volunteerism,Economic Opportunity; Healthy Futures
BOXWOOD LEARNING CENTER INC,Roselle,NJ,07203,814945906,AmeriCorps,Service & Volunteerism,Service & Volunteerism,Service and Volunteerism,Education
BOYS & GIRLS CLUB OF CENTRAL NEW MEXICO,Albuquerque,NM,87110,850106943,AmeriCorps,Service & Volunteerism,Service & Volunteerism,Service and Volunteerism,Capacity Building; Education
BOYS & GIRLS CLUB OF MANHATTAN INC,Manhattan,KS,66502,237358134,AmeriCorps,Service & Volunteerism,Service & Volunteerism,Service and Volunteerism,Education
BOYS & GIRLS CLUB OF NORTH LOUISIANA,Ruston,LA,71270,721375839,AmeriCorps,Service & Volunteerism,Service & Volunteerism,Service and Volunteerism,Capacity Building; Education; Healthy Futures
BOYS & GIRLS CLUB OF NORTHERN PLAINS INC,Brookings,SD,57006,731630215,AmeriCorps,Service & Volunteerism,Service & Volunteerism,Service and Volunteerism,Capacity Building; Education
"BOYS & GIRLS CLUB OF PHARR, INC.",Pharr,TX,78577,752258513,AmeriCorps,Service & Volunteerism,Service & Volunteerism,Service and Volunteerism,Education
BOYS & GIRLS CLUB OF VALDOSTA INC,Valdosta,GA,31601,237067775,AmeriCorps,Service & Volunteerism,Service & Volunteerism,Service and Volunteerism,Capacity Building; Education
