Name,City,State,Zip,EIN,Source,Goals,Category of Work,Methods,Focus Areas
County of Oswego,Oswego,NY,13126,156000463,AmeriCorps,Service & Volunteerism,Service & Volunteerism,Service and Volunteerism,Economic Opportunity; Healthy Futures
County of Sandoval,Bernalillo,NM,87004,856000244,AmeriCorps,Service & Volunteerism,Service & Volunteerism,Service and Volunteerism,Education; Healthy Futures
County of Sedgwick,Wichita,KS,67202,486000798,AmeriCorps,Service & Volunteerism,Service & Volunteerism,Service and Volunteerism,Capacity Building; Economic Opportunity; Healthy Futures
County of Socorro,Socorro,NM,87801,856000253,AmeriCorps,Service & Volunteerism,Service & Volunteerism,Service and Volunteerism,Education; Healthy Futures
County of Steuben,Bath,NY,14810,166002567,AmeriCorps,Service & Volunteerism,Service & Volunteerism,Service and Volunteerism,Healthy Futures
County of Washtenaw,Ann Arbor,MI,48104,386004894,AmeriCorps,Service & Volunteerism,Service & Volunteerism,Service and Volunteerism,Education
"Court Appointed Special Advocates Program, Inc.",Concord,CA,94520,942897531,AmeriCorps,Service & Volunteerism,Service & Volunteerism,Service and Volunteerism,Education
"Cove Behavioral Health, Inc.",Tampa,FL,33605,591514993,AmeriCorps,Service & Volunteerism,Service & Volunteerism,Service and Volunteerism,Healthy Futures
Covenant Community Inc.,Atlanta,GA,30308,582010185,AmeriCorps,Service & Volunteerism,Service & Volunteerism,Service and Volunteerism,Capacity Building; Economic Opportunity
"Cowden Street Collaborative, Inc",Central Falls,RI,02863,264751210,AmeriCorps,Service & Volunteerism,Service & Volunteerism,Service and Volunteerism,Education
"Cranston, City of",Cranston,RI,02910,056000110,AmeriCorps,Service & Volunteerism,Service & Volunteerism,Service and Volunteerism,Disaster Services; Economic Opportunity; Environmental Stewardship; Healthy Futures
Creative Institute of Central Arkansas,Conway,AR,72032,853649837,AmeriCorps,Service & Volunteerism,Service & Volunteerism,Service and Volunteerism,Capacity Building; Economic Opportunity
Creativity Explored,San Francisco,CA,94103,942801050,AmeriCorps,Service & Volunteerism,Service & Volunteerism,Service and Volunteerism,Capacity Building; Economic Opportunity
Crim Fitness Foundation,Flint,MI,48502,382595169,AmeriCorps,Service & Volunteerism,Service & Volunteerism,Service and Volunteerism,Capacity Building
Cultural Diversity Resources,Fargo,ND,58102,411896836,AmeriCorps,Service & Volunteerism,Service & Volunteerism,Service and Volunteerism,Capacity Building; Economic Opportunity; Education
Cuyahoga County Job and Family Services,Cleveland,OH,44114,346000817,AmeriCorps,Service & Volunteerism,Service & Volunteerism,Service and Volunteerism,Capacity Building; Healthy Futures
Cypress Hills Local Development Corp,Brooklyn,NY,11208,112683663,AmeriCorps,Service & Volunteerism,Service & Volunteerism,Service and Volunteerism,Education
DAVIS COUNTY GOVERNMENT,Farmington,UT,84025,876000297,AmeriCorps,Service & Volunteerism,Service & Volunteerism,Service and Volunteerism,Education; Environmental Stewardship; Healthy Futures
DAWSON EDUCATION SERVICE COOP,Arkadelphia,AR,71923,710597153,AmeriCorps,Service & Volunteerism,Service & Volunteerism,Service and Volunteerism,Education
"DEKALB, COUNTY OF",Decatur,GA,30030,581417092,AmeriCorps,Service & Volunteerism,Service & Volunteerism,Service and Volunteerism,Capacity Building
DELAWARE DEPARTMENT OF HEALTH & SOCIAL SERVICES,New Castle,DE,19720,516000279,AmeriCorps,Service & Volunteerism,Service & Volunteerism,Service and Volunteerism,Capacity Building; Economic Opportunity
DELAWARE DEPARTMENT OF STATE,Dover,DE,19901,516000279,AmeriCorps,Service & Volunteerism,Service & Volunteerism,Service and Volunteerism,Capacity Building; Economic Opportunity
DEPARTMENT OF EMPLOYMENT SECURITY WASHINGTON,Olympia,WA,98501,916001099,AmeriCorps,Service & Volunteerism,Service & Volunteerism,Service and Volunteerism,Disaster Services; Economic Opportunity; Education; Environmental Stewardship; Healthy Futures; Veterans and Military Families
DEPARTMENT OF ENVIRONMENTAL CONSERVATION VERMONT,Montpelier,VT,05620,474525424,AmeriCorps,Service & Volunteerism,Service & Volunteerism,Service and Volunteerism,Environmental Stewardship
DEPARTMENT OF LABOR & INDUSTRY PA,Harrisburg,PA,17120,236003107,AmeriCorps,Service & Volunteerism,Service & Volunteerism,Service and Volunteerism,Capacity Building
DEPARTMENT OF PUBLIC HEALTH AND SOCIAL SERVICES,Mangilao,GU,96913,980018947,AmeriCorps,Service & Volunteerism,Service & Volunteerism,Service and Volunteerism,Healthy Futures
DEPARTMENT OF SOCIAL SERVICES,Richmond,VA,23219,540959533,AmeriCorps,Service & Volunteerism,Service & Volunteerism,Service and Volunteerism,Capacity Building; Economic Opportunity; Healthy Futures
"DOUGLASS COMMUNITY SERVICES, INC",Hannibal,MO,63401,430971877,AmeriCorps,Service & Volunteerism,Service & Volunteerism,Service and Volunteerism,Capacity Building; Education; Healthy Futures
"DUBUQUE, THE CITY OF (INC)",Dubuque,IA,52001,426004596,AmeriCorps,Service & Volunteerism,Service & Volunteerism,Service and Volunteerism,Education
Dalton State College,Dalton,GA,30720,580975068,AmeriCorps,Service & Volunteerism,Service & Volunteerism,Service and Volunteerism,Capacity Building; Education; Healthy Futures
Damien Ministries Inc,Washington,DC,20018,521523098,AmeriCorps,Service & Volunteerism,Service & Volunteerism,Service and Volunteerism,Capacity Building; Healthy Futures
Daughters of Zion Enterpryz,Sacramento,CA,95823,943288179,AmeriCorps,Service & Volunteerism,Service & Volunteerism,Service and Volunteerism,Urban/Rural Development
Decorah Public Library,Decorah,IA,52101,426004485,AmeriCorps,Service & Volunteerism,Service & Volunteerism,Service and Volunteerism,Capacity Building; Economic Opportunity; Healthy Futures
Deep East Texas Council of Governments,Lufkin,TX,75904,751251001,AmeriCorps,Service & Volunteerism,Service & Volunteerism,Service and Volunteerism,Education; Environmental Stewardship; Healthy Futures; Veterans and Military Families
Delaware Adolescent Program Incorporated,Newark,DE,19702,510108498,AmeriCorps,Service & Volunteerism,Service & Volunteerism,Service and Volunteerism,Healthy Futures
Delaware County Office of Services for the Aging,Eddystone,PA,19022,236003046,AmeriCorps,Service & Volunteerism,Service & Volunteerism,Service and Volunteerism,Education
Della Lamb Community Services,Kansas City,MO,64106,440549931,AmeriCorps,Service & Volunteerism,Service & Volunteerism,Service and Volunteerism,Capacity Building; Economic Opportunity
"Delta Community Action Foundation, Inc",Lindsay,OK,73052,730775109,AmeriCorps,Service & Volunteerism,Service & Volunteerism,Service and Volunteerism,Education; Healthy Futures
Deming Luna County Commission on Aging Inc,Deming,NM,88030,850248639,AmeriCorps,Service & Volunteerism,Service & Volunteerism,Service and Volunteerism,Education; Healthy Futures
Department of Education/ Child Development Services,Augusta,ME,04333,016000001,AmeriCorps,Service & Volunteerism,Service & Volunteerism,Service and Volunteerism,Capacity Building; Education
Department of Human Services,St Thomas,VI,00802,660431678,AmeriCorps,Service & Volunteerism,Service & Volunteerism,Service and Volunteerism,Capacity Building; Disaster Services; Education; Healthy Futures; Veterans and Military Families
Department of Juvenile Services Maryland,Baltimore,MD,21202,526002033,AmeriCorps,Service & Volunteerism,Service & Volunteerism,Service and Volunteerism,Education
Dequeen Mena Educational Cooperative,Gillham,AR,71841,710616511,AmeriCorps,Service & Volunteerism,Service & Volunteerism,Service and Volunteerism,Education
Design Corps,Raleigh,NC,27608,232951348,AmeriCorps,Service & Volunteerism,Service & Volunteerism,Service and Volunteerism,Capacity Building; Economic Opportunity; Education; Environmental Stewardship; Healthy Futures
"Developmental Services of Northwest Kansas, Inc",Hays,KS,67601,480757621,AmeriCorps,Service & Volunteerism,Service & Volunteerism,Service and Volunteerism,Capacity Building; Education
"Developmental Services, California Department of",Sacramento,CA,95814,680282313,AmeriCorps,Service & Volunteerism,Service & Volunteerism,Service and Volunteerism,Education; Healthy Futures
Diakon Child Family & Community Ministries,Topton,PA,19562,465390969,AmeriCorps,Service & Volunteerism,Service & Volunteerism,Service and Volunteerism,Environmental Stewardship; Healthy Futures
Diamond In the Rough Youth Development Program Inc,Snellville,GA,30078,830428456,AmeriCorps,Service & Volunteerism,Service & Volunteerism,Service and Volunteerism,Capacity Building; Education
Diaper Bank of North Carolina,Durham,NC,27704,320401621,AmeriCorps,Service & Volunteerism,Service & Volunteerism,Service and Volunteerism,Capacity Building; Healthy Futures
Dickinson-Iron Community Services Agency,Iron Mountain,MI,49801,382889846,AmeriCorps,Service & Volunteerism,Service & Volunteerism,Service and Volunteerism,Economic Opportunity; Healthy Futures
Digital Harbor Foundation,Baltimore,MD,21230,452536579,AmeriCorps,Service & Volunteerism,Service & Volunteerism,Service and Volunteerism,Economic Opportunity; Education; Healthy Futures
Dignity Health Connected Living,Redding,CA,96003,237115371,AmeriCorps,Service & Volunteerism,Service & Volunteerism,Service and Volunteerism,Education; Healthy Futures
Dillard University Division of Student Success,New Orleans,LA,70122,720408929,AmeriCorps,Service & Volunteerism,Service & Volunteerism,Service and Volunteerism,Capacity Building; Education
Diocese of Syracuse Roman Catholic,Binghamton,NY,13905,161170407,AmeriCorps,Service & Volunteerism,Service & Volunteerism,Service and Volunteerism,Healthy Futures
District III Area Agency on Aging,Warrensburg,MO,64093,431015585,AmeriCorps,Service & Volunteerism,Service & Volunteerism,Service and Volunteerism,Healthy Futures
Dodge City Community College,Dodge City,KS,67801,521718586,AmeriCorps,Service & Volunteerism,Service & Volunteerism,Service and Volunteerism,Healthy Futures
Dove Inc,Decatur,IL,62522,370920903,AmeriCorps,Service & Volunteerism,Service & Volunteerism,Service and Volunteerism,Economic Opportunity; Healthy Futures
DownCity Design,Providence,RI,02903,271125644,AmeriCorps,Service & Volunteerism,Service & Volunteerism,Service and Volunteerism,Capacity Building; Education
Downeast Community Partners,Ellsworth,ME,04605,010288757,AmeriCorps,Service & Volunteerism,Service & Volunteerism,Service and Volunteerism,Capacity Building; Environmental Stewardship
"Dr. Piper Center for Social Services, Inc.",Fort Myers,FL,33916,650788551,AmeriCorps,Service & Volunteerism,Service & Volunteerism,Service and Volunteerism,Capacity Building; Economic Opportunity; Education; Healthy Futures
DreamTree Project,Taos,NM,87571,850462470,AmeriCorps,Service & Volunteerism,Service & Volunteerism,Service and Volunteerism,Economic Opportunity
Drew Lewis Foundation,Springfield,MO,65802,472991671,AmeriCorps,Service & Volunteerism,Service & Volunteerism,Service and Volunteerism,Capacity Building; Economic Opportunity
Drexel University,Philadelphia,PA,19104,231352630,AmeriCorps,Service & Volunteerism,Service & Volunteerism,Service and Volunteerism,Economic Opportunity
Drive To Thrive Mentoring Program,Vicksburg,MS,39180,863163161,AmeriCorps,Service & Volunteerism,Service & Volunteerism,Service and Volunteerism,Capacity Building
"Dubois-Pike-Warrick Economic Opportunity Committee, Inc. d/b/a TRI-CAP",Jasper,IN,47546,351121163,AmeriCorps,Service & Volunteerism,Service & Volunteerism,Service and Volunteerism,Environmental Stewardship; Healthy Futures; Veterans and Military Families
Duke University,Durham,NC,27705,560532129,AmeriCorps,Service & Volunteerism,Service & Volunteerism,Service and Volunteerism,Capacity Building; Education
Duluth Area Family Y.M.C.A.,Duluth,MN,55802,410693931,AmeriCorps,Service & Volunteerism,Service & Volunteerism,Service and Volunteerism,Education
Dundalk Renaissance Corp,Dundalk,MD,21222,522306483,AmeriCorps,Service & Volunteerism,Service & Volunteerism,Service and Volunteerism,Capacity Building; Economic Opportunity
Durham Public Schools Foundation,Durham,NC,27701,822803464,AmeriCorps,Service & Volunteerism,Service & Volunteerism,Service and Volunteerism,Capacity Building; Education
EAST CAROLINA UNIVERSITY,Greenville,NC,27858,566000403,AmeriCorps,Service & Volunteerism,Service & Volunteerism,Service and Volunteerism,Education
"EASTER SEALS NORTH GEORGIA, INC.",Clarkston,GA,30021,581919768,AmeriCorps,Service & Volunteerism,Service & Volunteerism,Service and Volunteerism,Education
EASTERN NEBRASKA HUMAN SERVICES AGENCY,Omaha,NE,68137,470531340,AmeriCorps,Service & Volunteerism,Service & Volunteerism,Service and Volunteerism,Education; Healthy Futures
ECO-SERVANTS,Ruidoso,NM,88345,201272940,AmeriCorps,Service & Volunteerism,Service & Volunteerism,Service and Volunteerism,Environmental Stewardship
ECONOMIC DEVELOPMENT MISSOURI DEPARTMENT,Jefferson City,MO,65101,446000987,AmeriCorps,Service & Volunteerism,Service & Volunteerism,Service and Volunteerism,Capacity Building; Education
EDUCATION ALLIANCE,Charleston,WV,25301,550630914,AmeriCorps,Service & Volunteerism,Service & Volunteerism,Service and Volunteerism,Capacity Building; Education
EGYPTIAN AREA AGENCY ON AGING INC,Carterville,IL,62918,371053330,AmeriCorps,Service & Volunteerism,Service & Volunteerism,Service and Volunteerism,Healthy Futures
EMMANUEL FAMILY & CHILD DEVELOPMENT,Kansas City,MO,64130,742925720,AmeriCorps,Service & Volunteerism,Service & Volunteerism,Service and Volunteerism,Education
ENGAGENJ A NJ NONPROFIT CORPORATION,Jersey City,NJ,07305,452475221,AmeriCorps,Service & Volunteerism,Service & Volunteerism,Service and Volunteerism,Capacity Building; Economic Opportunity; Education; Healthy Futures
"ETHIOPIAN COMMUNITY DEVELOPMENT COUNCIL, INC.",Arlington,VA,22204,521308986,AmeriCorps,Service & Volunteerism,Service & Volunteerism,Service and Volunteerism,Capacity Building; Economic Opportunity
EXECUTIVE OFFICE OF THE STATE OF ARIZONA,Phoenix,AZ,85007,866004791,AmeriCorps,Service & Volunteerism,Service & Volunteerism,Service and Volunteerism,Capacity Building
EXECUTIVE OFFICE OF THE STATE OF COLORADO,Denver,CO,80203,840644739,AmeriCorps,Service & Volunteerism,Service & Volunteerism,Service and Volunteerism,Capacity Building
EarthCorps,Seattle,WA,98115,911592071,AmeriCorps,Service & Volunteerism,Service & Volunteerism,Service and Volunteerism,Environmental Stewardship
EarthDance,Ferguson,MO,63135,274160056,AmeriCorps,Service & Volunteerism,Service & Volunteerism,Service and Volunteerism,Capacity Building; Healthy Futures
East Alabama Services for the Elderly Inc,Auburn,AL,36830,630672631,AmeriCorps,Service & Volunteerism,Service & Volunteerism,Service and Volunteerism,Education
East Bay Community Action Program,Newport,RI,02840,050310024,AmeriCorps,Service & Volunteerism,Service & Volunteerism,Service and Volunteerism,Capacity Building; Economic Opportunity; Education; Healthy Futures
East Boston Community Health Center Corporation,Boston,MA,02128,237425849,AmeriCorps,Service & Volunteerism,Service & Volunteerism,Service and Volunteerism,Healthy Futures
East Harris County Empowerment Council,Houston,TX,77029,270377576,AmeriCorps,Service & Volunteerism,Service & Volunteerism,Service and Volunteerism,Capacity Building; Disaster Services; Economic Opportunity
Easter Seals Wisconsin Inc,Madison,WI,53717,390824877,AmeriCorps,Service & Volunteerism,Service & Volunteerism,Service and Volunteerism,Healthy Futures; Veterans and Military Families
Eastern Michigan University,Ypsilanti,MI,48197,386005986,AmeriCorps,Service & Volunteerism,Service & Volunteerism,Service and Volunteerism,Economic Opportunity
Ecolibrium3,Duluth,MN,55806,452746481,AmeriCorps,Service & Volunteerism,Service & Volunteerism,Service and Volunteerism,Capacity Building; Disaster Services; Economic Opportunity; Education; Environmental Stewardship; Healthy Futures
Economic Development Authority Iowa,Des Moines,IA,50315,010606429,AmeriCorps,Service & Volunteerism,Service & Volunteerism,Service and Volunteerism,Capacity Building
"Economic Opportunity Authority For Savannah-Chatham County Area, Incorporated",Savannah,GA,31415,580952632,AmeriCorps,Service & Volunteerism,Service & Volunteerism,Service and Volunteerism,Education; Environmental Stewardship; Healthy Futures; Veterans and Military Families
Ecumen,Shoreview,MN,55126,911982139,AmeriCorps,Service & Volunteerism,Service & Volunteerism,Service and Volunteerism,Capacity Building; Healthy Futures
Educacion Para Nuestro Futuro Founded by Escuela Bolivia,Arlington,VA,22204,541914671,AmeriCorps,Service & Volunteerism,Service & Volunteerism,Service and Volunteerism,Capacity Building; Economic Opportunity; Education
Education Forward Arizona,Phoenix,AZ,85018,202366755,AmeriCorps,Service & Volunteerism,Service & Volunteerism,Service and Volunteerism,Education
"Education, Maine Department Of",Augusta,ME,04333,016000001,AmeriCorps,Service & Volunteerism,Service & Volunteerism,Service and Volunteerism,Capacity Building; Education
Educational Justice Inc,Louisville,KY,40203,270405207,AmeriCorps,Service & Volunteerism,Service & Volunteerism,Service and Volunteerism,Capacity Building; Education
Educational Service District 101,Spokane,WA,99223,910948293,AmeriCorps,Service & Volunteerism,Service & Volunteerism,Service and Volunteerism,Economic Opportunity
"Edward M Kennedy Community Health Center, Inc.",Worcester,MA,01605,042513817,AmeriCorps,Service & Volunteerism,Service & Volunteerism,Service and Volunteerism,Healthy Futures
Eightcap Inc,Orleans,MI,48865,386111652,AmeriCorps,Service & Volunteerism,Service & Volunteerism,Service and Volunteerism,Education; Healthy Futures
El Paso County,El Paso,TX,79901,746000762,AmeriCorps,Service & Volunteerism,Service & Volunteerism,Service and Volunteerism,Capacity Building; Economic Opportunity
El Paso Independent School District Education Foundation,El Paso,TX,79902,746000769,AmeriCorps,Service & Volunteerism,Service & Volunteerism,Service and Volunteerism,Capacity Building; Education
"El Paso, City of",El Paso,TX,79901,746000749,AmeriCorps,Service & Volunteerism,Service & Volunteerism,Service and Volunteerism,Capacity Building; Education; Healthy Futures
El Pasoans Fighting Hunger Food Bank,El Paso,TX,79927,452893839,AmeriCorps,Service & Volunteerism,Service & Volunteerism,Service and Volunteerism,Capacity Building; Healthy Futures; Urban/Rural Development
"Elder Care Services, Inc.",Tallahassee,FL,32304,591426079,AmeriCorps,Service & Volunteerism,Service & Volunteerism,Service and Volunteerism,Education; Healthy Futures
ElderCircle,Grand Rapids,MN,55744,411994691,AmeriCorps,Service & Volunteerism,Service & Volunteerism,Service and Volunteerism,Capacity Building; Economic Opportunity; Healthy Futures
Elderlife Inc,Utica,NY,13501,161557404,AmeriCorps,Service & Volunteerism,Service & Volunteerism,Service and Volunteerism,Healthy Futures
"Elderly United of Springfield and Clark County, Ohio, Inc.",Springfield,OH,45502,310747271,AmeriCorps,Service & Volunteerism,Service & Volunteerism,Service and Volunteerism,Education; Healthy Futures
Eldon R 1 School District,Eldon,MO,65026,446002437,AmeriCorps,Service & Volunteerism,Service & Volunteerism,Service and Volunteerism,Education
Elepaio Social Services,Waianae,HI,96792,871098803,AmeriCorps,Service & Volunteerism,Service & Volunteerism,Service and Volunteerism,Capacity Building; Healthy Futures
"Elev8 Baltimore, Inc.",Baltimore,MD,21201,460889783,AmeriCorps,Service & Volunteerism,Service & Volunteerism,Service and Volunteerism,Capacity Building; Education
"Elevate Tutoring, INC.",San Jose,CA,95125,451058760,AmeriCorps,Service & Volunteerism,Service & Volunteerism,Service and Volunteerism,Capacity Building; Education
Elon University,Elon,NC,27244,560532303,AmeriCorps,Service & Volunteerism,Service & Volunteerism,Service and Volunteerism,Capacity Building; Education; Healthy Futures
Emanuel Preparatory School of Math and Science,Midland,GA,31820,474319631,AmeriCorps,Service & Volunteerism,Service & Volunteerism,Service and Volunteerism,Capacity Building; Education
Emerald Youth Foundation,Knoxville,TN,37921,621474791,AmeriCorps,Service & Volunteerism,Service & Volunteerism,Service and Volunteerism,Education
Emporia State University,Emporia,KS,66801,481124839,AmeriCorps,Service & Volunteerism,Service & Volunteerism,Service and Volunteerism,Education
"Encompass Early Education and Care, Inc.",Green Bay,WI,54301,390824004,AmeriCorps,Service & Volunteerism,Service & Volunteerism,Service and Volunteerism,Education
Enhancing and Strengthening North Dakota Nonprofits and Communities,Minot,ND,58703,475449750,AmeriCorps,Service & Volunteerism,Service & Volunteerism,Service and Volunteerism,Capacity Building; Economic Opportunity; Environmental Stewardship; Healthy Futures
"Enterprise Community Partners, Inc.",Columbia,MD,21044,521231931,AmeriCorps,Service & Volunteerism,Service & Volunteerism,Service and Volunteerism,Capacity Building; Economic Opportunity
Entryway,Vienna,VA,22182,471004312,AmeriCorps,Service & Volunteerism,Service & Volunteerism,Service and Volunteerism,Capacity Building; Economic Opportunity
Envisioneers Inc,Redwood City,CA,94065,862828543,AmeriCorps,Service & Volunteerism,Service & Volunteerism,Service and Volunteerism,Education
"Epilepsy Foundation New England, Inc",Lowell,MA,01854,222505819,AmeriCorps,Service & Volunteerism,Service & Volunteerism,Service and Volunteerism,Healthy Futures
Equal Heart,Dallas,TX,75220,462846816,AmeriCorps,Service & Volunteerism,Service & Volunteerism,Service and Volunteerism,Economic Opportunity; Education; Healthy Futures
Equal Justice Wyoming,Cheyenne,WY,82002,830208667,AmeriCorps,Service & Volunteerism,Service & Volunteerism,Service and Volunteerism,Capacity Building; Economic Opportunity; Healthy Futures
Equity Now Inc,Lanham,MD,20706,822008232,AmeriCorps,Service & Volunteerism,Service & Volunteerism,Service and Volunteerism,Education
"Erie, County of",Buffalo,NY,14202,166002558,AmeriCorps,Service & Volunteerism,Service & Volunteerism,Service and Volunteerism,Capacity Building; Economic Opportunity; Education; Environmental Stewardship; Healthy Futures; Veterans and Military Families
Esperanza Para La Vejez Inc,Bayamon,PR,00956,660268234,AmeriCorps,Service & Volunteerism,Service & Volunteerism,Service and Volunteerism,Education; Healthy Futures
"Ethos, Inc.",Portland,OR,97217,911954235,AmeriCorps,Service & Volunteerism,Service & Volunteerism,Service and Volunteerism,Capacity Building; Education
"Etowah, County of",Gadsden,AL,35901,636001533,AmeriCorps,Service & Volunteerism,Service & Volunteerism,Service and Volunteerism,Capacity Building; Economic Opportunity; Education; Healthy Futures
Evanston Rebuilding Warehouse,Evanston,IL,60202,273797852,AmeriCorps,Service & Volunteerism,Service & Volunteerism,Service and Volunteerism,Capacity Building; Economic Opportunity
Evelyn Rubenstein Jewish Community Center of Houston,Houston,TX,77096,741198298,AmeriCorps,Service & Volunteerism,Service & Volunteerism,Service and Volunteerism,Disaster Services; Economic Opportunity; Education; Healthy Futures
"Every Arkansan, Inc.",North Little Rock,AR,72114,270730530,AmeriCorps,Service & Volunteerism,Service & Volunteerism,Service and Volunteerism,Education; Healthy Futures
Ewalu Inc.,Kailua Kona,HI,96740,882442548,AmeriCorps,Service & Volunteerism,Service & Volunteerism,Service and Volunteerism,Capacity Building
FAMILIES AND YOUTH INCORPORATED (FYI),Las Cruces,NM,88001,850275762,AmeriCorps,Service & Volunteerism,Service & Volunteerism,Service and Volunteerism,Education
FAMILY & CHILDREN'S ASSOCIATION,Garden City,NY,11530,113422018,AmeriCorps,Service & Volunteerism,Service & Volunteerism,Service and Volunteerism,Healthy Futures
FELLOWSHIP CUP,Mount Pleasant,IA,52641,421298639,AmeriCorps,Service & Volunteerism,Service & Volunteerism,Service and Volunteerism,Capacity Building; Education; Healthy Futures
FEMA - Region VI,Denton,TX,76209,720564834,AmeriCorps,Service & Volunteerism,Service & Volunteerism,Service and Volunteerism,Disaster Recovery/Relief
"FEMA- Headquarters- FEMA Office- Washington, DC",Washington,DC,20024,720564834,AmeriCorps,Service & Volunteerism,Service & Volunteerism,Service and Volunteerism,Disaster Recovery/Relief
FEMA-Region 9,Oakland,CA,94607,72-0564834,AmeriCorps,Service & Volunteerism,Service & Volunteerism,Service and Volunteerism,Disaster Recovery/Relief
FEMA-Region IV-Atlanta,Atlanta,GA,30341,72-0564834,AmeriCorps,Service & Volunteerism,Service & Volunteerism,Service and Volunteerism,Disaster Recovery/Relief
FIELD & FORK NETWORK INC,Buffalo,NY,14214,264287659,AmeriCorps,Service & Volunteerism,Service & Volunteerism,Service and Volunteerism,Capacity Building; Healthy Futures
FINM Solutions,Saint Clair Shores,MI,48081,852248065,AmeriCorps,Service & Volunteerism,Service & Volunteerism,Service and Volunteerism,Capacity Building
FIREWALL CENTERS,Cooper City,FL,33330,061704451,AmeriCorps,Service & Volunteerism,Service & Volunteerism,Service and Volunteerism,Education
FLORIDA COMMISSION ON COMMUNITY SERVICE,Tallahassee,FL,32308,611596268,AmeriCorps,Service & Volunteerism,Service & Volunteerism,Service and Volunteerism,Capacity Building; Economic Opportunity; Environmental Stewardship
FLORIDA DEPARTMENT OF ENVIRONMENTAL PROTECTION,Tallahassee,FL,32399,596007353,AmeriCorps,Service & Volunteerism,Service & Volunteerism,Service and Volunteerism,Environmental Stewardship
FOCUS HOPE,Detroit,MI,48238,381948285,AmeriCorps,Service & Volunteerism,Service & Volunteerism,Service and Volunteerism,Capacity Building; Economic Opportunity; Education; Healthy Futures
