Citizens Assisting Collin County Sheriff's Office CACCSO,75-2747894,501(c)(3),,Practitioner Organization,,,https://caccso.org/public/,"The mission of Citizens Assisting Collin County Sheriff's Office (CACCSO) is to bring together the graduates of the Collin County Sheriff's Office Citizen's Academy to enhance the relations between the Sheriff's Office and the community by volunteering their time to provide continuing support to the Sheriff's office in a variety of areas.

CACCSO members may assist with civic events, such as helping in the Sheriff's booth at various activities, including crime watch meetings or events at local schools. Riding with deputies on patrol gives you a fuller realization of what a deputy faces under real life conditions. CACCSO meets monthly at the Sheriff's office in McKinney, Texas.",,T. Kincaid,4300 Community Ave,Mckinney,TX,75071,,,Community/Local - single,Service and Volunteerism,Civic Associations,,,"Including public policy issues? Public safety and security 
The sharing, reporting and feedback by citizens about public problems and services - Citizen-Driven Data Sharing - resolved 05-02
",,"Civic Infrastructure Development,Safety and Security,Citizen Reporting and Information Sharing",,,,,33.1976496,-96.6154471,
Woodmen of the World Omaha Woodmen Life Insurance Society,23-7630522,501(c)(8),,Practitioner Organization,Chapter,,,,,,1306 White Cir,Mckinney,TX,75069,,,,Service and Volunteerism,Service & Volunteerism,,,chapter organization to be batched;,,Service & Volunteerism,,,,,33.1976496,-96.6154471,
Woodmen of the World Omaha Woodmen Life Insurance Society,23-7630222,501(c)(8),,Practitioner Organization,Chapter,,,,,,1306 White Cir,Mckinney,TX,75069,,,,Service and Volunteerism,Service & Volunteerism,,,chapter organization to be batched;,,Service & Volunteerism,,,,,33.1976496,-96.6154471,
Transgender Education Network of Texas (TENT),26-3243093,501(c)(3),TENT,Practitioner Organization,,,https://www.transtexas.org/,"TENT is an organization dedicated to furthering gender-diverse equality in Texas. We work to accomplish this through education and networking in both public and private forums. Through our efforts, we strive to halt discrimination through social, legislative, and corporate education.",,,"11611 W. Airport Blvd., #180 ",Meadows Place,TX,77477,info@transtexas.org,(877) 532-6789,State - single,"Policy Advocacy and Analysis,Advocacy,Community-Building / Networking,Food Justice and Access,Mental Health",Organizing & Advocacy,,,,,"Social Justice,Civil and Political Rights",MVP,,,,29.6513439,-95.5880005,
Woodmen of the World Life Insurance Society,75-1561422,501(c)(8),,,,,,Promotetheinsuranceindustry,,,1305 Junction Run,Mesquite,TX,75181,,,Community/Local - single,Service and Volunteerism,Service & Volunteerism,,,chapter organization to be batched;,,Service & Volunteerism,,,,,32.7666103,-96.599472,
League of Women Voters of Midland,75-1968944,501(c)(3),,Practitioner Organization,Chapter,,https://www.facebook.com/lwvmidland/,"The League of Women Voters, a nonpartisan political organization, encourages the informed and active participation of citizens in government and influences public policy through education and advocacy.",,,PO Box 7437,Midland,TX,79708,lwvmidland@yahoo.com,,Community/Local - single,,Voter Engagement,,,,,"Voter Engagement/Registration/Education,Diversity & Inclusion",,,,,31.9973662,-102.077948,
Senior Life Midland,751899190,,,,,,,,,,,Midland,TX,79707,,,,Service and Volunteerism,Service & Volunteerism,,,,,Service & Volunteerism,,,,,31.9973662,-102.077948,
Mentors Care,30-0689961,501(c)(3),,Practitioner Organization,,,https://www.mentors.care/,"Mentors Care’s mission is to connect high school students who are at risk of not graduating with mentors, tools, and resources to help lead them toward graduation and purposeful, fulfilling lives. Mentors Care will work with school districts that are historically underserved to enlist, train, and equip adult volunteer mentors who care about and believe in the kids they serve.",,Dena  Petty,661 E Main St Ste 200,Midlothian,TX,76065,info@mentors.care,(501) 628-4252,Community/Local - multiple,"Youth Engagement,Service and Volunteerism",Service & Volunteerism,,,,,Service & Volunteerism,,,,,32.482361,-96.9944489,
Woodmen of the World Life Insurance Society,23-7630203,501(c)(8),,Practitioner Organization,Chapter,,,,,,256 County Road 360,Milano,TX,76556,,,,Service and Volunteerism,Service & Volunteerism,,,chapter organization to be batched;,,Service & Volunteerism,,,,,30.7106407,-96.864745,
Woodmen of the World Life Insurance Society,23-7630241,501(c)(8),,Practitioner Organization,Chapter,,,,,,150 COUNTY ROAD 2258,MINEOLA,TX,75773,,,,Service and Volunteerism,Service & Volunteerism,,,chapter organization to be batched;,,Service & Volunteerism,,,,,32.6633387,-95.4880308,
Woodmen of the World Life Insurance Society,75-1832522,501(c)(8),,Practitioner Organization,Chapter,,,,,,1920 S Keller Rd,Mineral Wells,TX,76067,,,,Service and Volunteerism,Service & Volunteerism,,,chapter organization to be batched;,,Service & Volunteerism,,,,,32.8084605,-98.1128223,
Woodmen of the World Life Insurance Society,23-7417739,501(c)(8),,Practitioner Organization,Chapter,,,,,,5902 Princess Ln,Nacogdoches,TX,75961,,,,Service and Volunteerism,Service & Volunteerism,,,chapter organization to be batched;,,Service & Volunteerism,,,,,31.6037322,-94.6559702,
Woodmen of the World Life Insurance Society,23-7630342,501(c)(8),,Practitioner Organization,Chapter,,,,,,18339 Davis Estate Rd,Needville,TX,77461,,,,Service and Volunteerism,Service & Volunteerism,,,chapter organization to be batched;,,Service & Volunteerism,,,,,29.3974305,-95.8380978,
Woodmen of the World Life Insurance Society,75-2246336,501(c)(8),,Practitioner Organization,Chapter,,,,,,515 W FM 6,Nevada,TX,75173,,,,Service and Volunteerism,Service & Volunteerism,,,chapter organization to be batched;,,Service & Volunteerism,,,,,33.0400671,-96.3730646,
Communities In Schools of South Central Texas,742653402,,,,,,,,,,,New Braunfels,TX,78130,,,,Service and Volunteerism,Service & Volunteerism,,,,,Service & Volunteerism,,,,,29.7028266,-98.1257348,
League of Women Voters of Comal Area,74-2685378,501(c)(3),,Practitioner Organization,Chapter,,https://www.lwvcomal.org/,"Mission
Empowering voters. Defending democracy.

Vision
We envision a democracy where every person has the desire, the right, the knowledge and the confidence to participate.

Value
We believe in the power of women to create a more perfect democracy.",,Jerrie Champlin,PO Box 311324,New Braunfels,TX,78131,president@lwvcomal.org,(830) 643-4657,Community/Local - single,"Advocacy,Organizing,Education",Voter Engagement,,,,,"Voter Engagement/Registration/Education,Diversity & Inclusion,Transparency and Addressing Mis/Disinformation,Electoral Reform",,,,,29.7028266,-98.1257348,
Woodmen of the World Omaha Woodmen Life Insurance Society,23-7630216,501(c)(8),,Practitioner Organization,Chapter,,,,,,207 S Liberty Ave,New Braunfels,TX,78130,,,,Service and Volunteerism,Service & Volunteerism,,,chapter organization to be batched;,,Service & Volunteerism,,,,,29.7028266,-98.1257348,
Woodmen of the World Life Insurance Society,23-7630213,501(c)(8),,Practitioner Organization,Chapter,,,,,,PO Box 125,New Summerfield,TX,75780,,,,Service and Volunteerism,Service & Volunteerism,,,chapter organization to be batched;,,Service & Volunteerism,,,,,31.9807226,-95.0938322,
Woodmen of the World Life Insurance Society,75-2087740,501(c)(8),,Practitioner Organization,Chapter,,,,,,17013 CR 4561,NORMANGEE,TX,77871,,,,Service and Volunteerism,Service & Volunteerism,,,chapter organization to be batched;,,Service & Volunteerism,,,,,31.0297095,-96.1169986,
Woodmen of the World Life Insurance Society,65-1260497,501(c)(8),,Practitioner Organization,Chapter,,,,,,9667 Caldwell Rd,Normangee,TX,77871,,,,Service and Volunteerism,Service & Volunteerism,,,chapter organization to be batched;,,Service & Volunteerism,,,,,31.0297095,-96.1169986,
Woodmen of the World Life Insurance Society,23-7630254,501(c)(8),,Practitioner Organization,Chapter,,,,,,5706 N Dixie Blvd,Odessa,TX,79762,,,,Service and Volunteerism,Service & Volunteerism,,,chapter organization to be batched;,,Service & Volunteerism,,,,,31.8457149,-102.367687,
Woodmen of the World Omaha Woodmen Life Insurance Society,23-7630340,501(c)(8),,Practitioner Organization,Chapter,,,,,,7067 S FM 4,Palo Pinto,TX,76484,,,,Service and Volunteerism,Service & Volunteerism,,,chapter organization to be batched;,,Service & Volunteerism,,,,,32.7668959,-98.2993631,
Paris Jr College,756002205,,,,,,,,,,,Paris,TX,75460,,,,Service and Volunteerism,Service & Volunteerism,,,,,Service & Volunteerism,,,,,33.6617962,-95.555513,
Woodmen of the World Omaha Woodmen TX-1996,23-7630259,501(c)(8),,Practitioner Organization,Chapter,,,,,,PO Box 210,Pattison,TX,77466,,,,Service and Volunteerism,Service & Volunteerism,,,chapter organization to be batched;,,Service & Volunteerism,,,,,29.8252297,-95.9949564,
We Got This TX,87-1255180,501(c)(3),,Practitioner Organization,,,https://wegotthistx.com/,"We Got This TX is on a mission to train, support, and create opportunities for Black, Indigenous, and women of color (BIWOC) to participate in civic life and the Texas legislative process. We endeavor to create a pipeline of opportunity because we believe that the Black, Indigenous, and women of color who lead, serve, and organize our communities deserve equitable representation in every aspect of civic life and the Texas legislative process.

We are fiercely committed to sparking transformative change for a more just and representative Texas. We Got This TX believes that all Texas communities will be better served when there is equitable access to civic participation and representation in the Texas legislative process. We also believe that it is the role of We Got This TX to provide the tools that Black, Indigenous, and women of color need to participate in civic life and engage in the Texas legislative process so that they can speak truth to power. Our lived experience is expertise that belongs in the halls of power.

We are a nonpartisan organization. We do not take positions on issues, policies, or candidates. We support program participants in engaging civically and unapologetically voicing their priorities in their own words and on their own terms. The views expressed by our program participants are their own and do not constitute the views or positions of We Got This TX.",,,16216 Chianti Cv,Pflugerville,TX,78660,info@wegotthistx.com,,State - single,"Advocacy,Education,Leadership Training,Narrative Storytelling,Community-Building / Networking","Voter Engagement,Organizing & Advocacy",,,,,"Diversity & Inclusion,Voter Engagement/Registration/Education,Election Protection",,,,,30.4393696,-97.6200043,
"BOYS & GIRLS CLUB OF PHARR, INC.",752258513,,,,,,,,,,,Pharr,TX,78577,,,,Service and Volunteerism,Service & Volunteerism,,,,,Service & Volunteerism,,,,,26.1947962,-98.1836216,
Woodmen of the World Life Insurance Society,23-7630458,501(c)(8),,Practitioner Organization,Chapter,,,,,,406 S Woodland Dr,Pharr,TX,78577,,,,Service and Volunteerism,Service & Volunteerism,,,chapter organization to be batched;,,Service & Volunteerism,,,,,26.1947962,-98.1836216,
Woodmen of the World Life Insurance Society,75-2028147,501(c)(8),,Practitioner Organization,Chapter,,,,,,554 COUNTY ROAD 4248,PITTSBURG,TX,75686,,,,Service and Volunteerism,Service & Volunteerism,,,chapter organization to be batched;,,Service & Volunteerism,,,,,32.9954021,-94.9657688,
Woodmen of the World Life Insurance Society,23-7630167,501(c)(8),,Practitioner Organization,Chapter,,,,,,132 Jefferson St Ste B,Pittsburg,TX,75686,,,,Service and Volunteerism,Service & Volunteerism,,,chapter organization to be batched;,,Service & Volunteerism,,,,,32.9954021,-94.9657688,
City of Plainview,756000639,,,,,,,,,,,Plainview,TX,79072,,,,Service and Volunteerism,Service & Volunteerism,,,,,Service & Volunteerism,,,,,34.1847936,-101.706841,
Art & Drama Centre Theatre,27-3293759,501(c)(3),,,,,https://www.artcentretheatre.com/,"The Art Centre Theatre's (ACT) main objectives are to:

1. Present recurring seasons of the best possible theatrical and artistic works using the best talent and materials available. 

2. Produce new, traditional, local, dramatic, comedic and musical and                         experimental theatrical works at a low cost to the public.

3. Present entertaining and educational children's programming during the school day, evenings and on weekends.

4. Satisfy the needs of special audiences.

5. Instill in the community a sense of unity and cohesion through the                          presentation of works that challenge conventional ideals and commonly accepted mores. ACT accomplishes these goals through the presentation of a highly varied program of musical theatre, drama, comedy, opera, operetta, dance, children's theatre, concerts and art exhibits in a season that runs year-round.",,,1400 Summit Ave,Plano,TX,75074,,,Community/Local - single,Arts and Culture,Service & Volunteerism,,,,,Civic Arts,,,,,33.0136764,-96.6925096,
Dfw Asian American Citizens Council,75-2937979,501(c)(3),,Practitioner Organization,,,https://www.dfwaacc.org/dfwaacc/,"The mission of DFW AACC is to promote and assist Asian-American involvement in local, social, political, and civic activities that increase community awareness, improve Asian-American representation, and enhance the quality of life.",,,420 Maplelawn Dr,Plano,TX,75075,dfwaacc.box@gmail.com,,Community/Local - multiple,"Youth Engagement,Leadership Training,Community-Building / Networking,Funding,Membership",Civic Associations,,,,,"Diversity & Inclusion,Community Engagement and Community Building,Social Isolation,Voter Engagement/Registration/Education,Youth Engagement and Leadership",,,,,33.0136764,-96.6925096,
Hispanic Republican Club of North Texas,82-5362435,501(c)(3),,Practitioner Organization,,,https://www.facebook.com/HRCNT,"The mission of the Hispanic Republican Club of North Texas is to influence, educate, promote, and support both policies and elected officials that advance the rule of law, provide for the core functions of government in a fiscally responsible manner, and represent citizens with transparency and integrity.",,,PO Box 941081,Plano,TX,75094,hispanicgop01@gmail.com,(561) 843-1288,Community/Local - single,"Dialogue,Communications",Deliberative/Participatory/Direct Democracy,,,,,"Voter Engagement/Registration/Education,Responsive Governance",,,,,33.0136764,-96.6925096,
League of Women Voters of Collin County,51-0155936,501(c)(3),,Practitioner Organization,Chapter,,https://www.lwvcollin.org/,"The League of Women Voters of Collin County is a 501C3 nonpartisan organization.

Our mission is ‘Empowering voters. Defending democracy.’

People of all genders who support the mission are invited to join.",,Janet R Imhoff,PO Box 866592,Plano,TX,75086,lwvcollin@gmail.com,,State - single,"Organizing,Advocacy,Education,Membership,Dialogue",Voter Engagement,,,,,"Voter Engagement/Registration/Education,Voting Rights and Voter Participation,Diversity & Inclusion,Civic Forums for Discussion of Public Issues",,,,,33.0136764,-96.6925096,
Woodmen of the World Omaha Woodmen Life Insurance Society,23-7630257,501(c)(8),,Practitioner Organization,Chapter,,,,,,105 Crestfield Dr,Pleasanton,TX,78064,,,,Service and Volunteerism,Service & Volunteerism,,,chapter organization to be batched;,,Service & Volunteerism,,,,,28.967194,-98.4786269,
Woodmen of the World Omaha Woodmen Life Insurance Society,23-7630362,501(c)(8),,Practitioner Organization,Chapter,,,,,,2627 10th St,Port Arthur,TX,77640,,,,Service and Volunteerism,Service & Volunteerism,,,chapter organization to be batched;,,Service & Volunteerism,,,,,29.8716577,-93.9332302,
Woodmen of the World Omaha Woodmen Life Insurance Society,23-7630499,501(c)(8),,Practitioner Organization,Chapter,,,,,,PO Box 1500,Quitman,TX,75783,,,,Service and Volunteerism,Service & Volunteerism,,,chapter organization to be batched;,,Service & Volunteerism,,,,,32.7957722,-95.4518285,
Christians Engaged,84-2478845,501(c)(3),,Practitioner Organization,,,https://christiansengaged.org/,"TO AWAKEN, MOTIVATE, EDUCATE, AND EMPOWER ORDINARY BELIEVERS IN JESUS CHRIST TO: PRAY FOR OUR NATION AND ELECTED OFFICIALS REGULARLY, TO VOTE IN EVERY ELECTION TO IMPACT OUR CULTURE, AND TO ENGAGE OUR HEARTS IN SOME FORM OF CIVIC EDUCATION AND INVOLVEMENT FOR THE WELLBEING OF OUR NATION.",,Bunni  Pounds,2600 E RENNER RD APT 229,RICHARDSON,TX,75082,info@christiansengaged.org,(972) 271-7788,National,"Education,Podcasts/Radio,Print and Digital Publication,Communications","Voter Engagement,Faith-Based Efforts",,,,,"Voter Engagement/Registration/Education,Civic Education,Voting Rights and Voter Participation,Faith-Based Organizing/Engagement/Advocacy",,,,,32.9481789,-96.7297206,
Causability,85-2552519,501(c)(3),,Funder,,, https://causability.org/,"Causability is a 501(c)(3) nonprofit, community cause-based philanthropic fundraising donor platform.

Our mission to give voices through empowering causes using our crowdfunding platform.",,Elizabeth London,1606 Cheyenne Dr,Richardson,TX,75080,info@causability.org,,"""Regional (e.g. Midwest, South)""","Crowdfunding,Arts and Culture,Funding",Organizing & Advocacy,Impact Investing,,,,"Diversity & Inclusion,Civic Arts,Healing Justice,Economic Advocacy/Justice/Reform",,,,,,,
League of Women Voters of Richardson,75-6043960,501(c)(3),,Practitioner Organization,Chapter,,https://www.lwvrichardson.org/,"The League of Women Voters, a nonpartisan political organization, encourages the informed and active participation of citizens in government and influences public policy through education and advocacy.",,Ellen Steger,300 N Coit Rd Ste 125,Richardson,TX,75080,league@lwvrichardson.org,(972) 470-0584,Community/Local - single,"Organizing,Advocacy,Membership,Education,Dialogue",Voter Engagement,,,,,"Voter Engagement/Registration/Education,Voting Rights and Voter Participation,Diversity & Inclusion,Electoral Reform",,,,,32.9481789,-96.7297206,
Richardson Citizen Fire Academy Alumni Association,75-2884604,501(c)(3),,Practitioner Organization,,,https://www.cor.net/departments/fire-department/citizen-s-fire-academy-alumni-association,"The mission of the Richardson Citizen Fire Academy Alumni Association (RCFAAA) is to function in an auxiliary capacity to assist, promote, and support the Richardson Fire Department through service, education and recognition.",,,300 N Greenville Ave,Richardson,TX,75081,fmo@cor.gov,,Community/Local - single,"Funding,Service and Volunteerism,Education",Civic Associations,,,"tag for public safety/security

tagged/resolved 05/02",,"Civic Infrastructure Development,Safety and Security",,,,,32.9481789,-96.7297206,
Fort Bend Family Health Center,741951476,,,,,,,,,,,Richmond,TX,77469,,,,Service and Volunteerism,Service & Volunteerism,,,,,Service & Volunteerism,,,,,29.5821811,-95.7607832,
Minaret Foundation,83-3372048,501(c)(3),,Practitioner Organization,,,https://minaretfoundation.com/,"Minaret Foundation’s mission is to bring faith communities together to change the world around us through multi-faith and civic engagement.

Our vision is to see a world where our faith communities seek each other’s help to better the world as the norm, instead of the exception.",,Shariq Abdul Ghani,19902 Sonterra Ln,Richmond,TX,77407,info@minaretfoundation.com,(281) 401-9229,,"Advocacy,Policy Advocacy and Analysis,Organizing,Food Justice and Access,Mental Health,Youth Engagement,Education",Faith-Based Efforts,,,,,"Interfaith Organizing/Engagement,Policy Development",,,,,29.5821811,-95.7607832,
Woodmen of the World Life Insurance Society,23-7630230,501(c)(8),,Practitioner Organization,Chapter,,,,,,PO Box 1147,Richmond,TX,77406,,,,Service and Volunteerism,Service & Volunteerism,,,chapter organization to be batched;,,Service & Volunteerism,,,,,29.5821811,-95.7607832,
Woodmen of the World Life Insurance Society,23-7630357,501(c)(8),,Practitioner Organization,Chapter,,,,,,109 N Muniz St,Rio Grande City,TX,78582,,,,Service and Volunteerism,Service & Volunteerism,,,chapter organization to be batched;,,Service & Volunteerism,,,,,26.3827771,-98.8205251,
Woodmen of the World Life Insurance Society 6052,23-7630541,501(c)(8),,Practitioner Organization,Chapter,,,,,,125 S Arredondo St,Rio Grande City,TX,78582,,,,Service and Volunteerism,Service & Volunteerism,,,chapter organization to be batched;,,Service & Volunteerism,,,,,26.3827771,-98.8205251,
Texas Citizens On Patrol Association,82-5477884,501(c)(3),,Practitioner Organization,,,https://txcop.org/,TCOPA believes in the importance of volunteerism and especially in the field of law enforcement. Our mission is to provide the type of ongoing training for police volunteers to assist them in the performance of non-law enforcement functions so that police officers can be available to answer higher priority calls. C.O.P. volunteers are the additional eyes and ears for law enforcement. Police volunteers play a vital roll in their community by acting as a force multiplier for their local police department.,,,PO Box 1141,Roanoke,TX,76262,tcopaboard@gmail.com,,Community/Local - single,"Education,Service and Volunteerism",Civic Associations,,,tag fo public safety/security;,,Safety and Security,,,,,33.0040126,-97.2258483,
Woodmen of the World Life Insurance Society 0428,23-7630221,501(c)(8),,Practitioner Organization,Chapter,,,,,,103 Glenn Ave # 337,Rockwall,TX,75087,,,,Service and Volunteerism,Service & Volunteerism,,,chapter organization to be batched;,,Service & Volunteerism,,,,,32.9312336,-96.4597089,
Collegiate Edu-Nation,832468060,,,,,,,,,,,Roscoe,TX,79545,,,,Service and Volunteerism,Service & Volunteerism,,,,,Service & Volunteerism,,,,,32.441615,-100.539297,
Brazoria County Voter Initiative,88-3894542,501(c)(3),,Practitioner Organization,,,https://www.brazoriacountyvoterinitiative.org/,"The Mission of the Brazoria County Voter Initiative is to TRAIN and EDUCATE the public to facilitate Voter Engagement. We pride ourselves in providing exceptional workshop presentations of the highest standards to educate, train, and energization the community to prioritize voting and maintain consistent voter engagement. Each workshop presentation tailored to address the specific needs of your audience and is designated to dissect and present vital information on current voting rules and regulations taking on innovative approach to continuing to educate on the challenges of voting.",,,5519 Autumn Ash Ln,Rosharon,TX,77583,bcvoterinitiative@gmail.com,(832) 848-0815,Community/Local - single,Education,Voter Engagement,,,,,Voter Engagement/Registration/Education,,,,,29.3521203,-95.460341,
American Values Project,86-3620603 ,501(c)(4),,Practitioner Organization,,,https://theamericanvaluesproject.com/,"The American Values Project is a non-profit organization committed to the founding values that America is strongest when our local communities are strongest. We will fight the toxic nature of our national politics by investing in local communities and the people who want to set a better example of what “a more perfect union” should look like. We believe that an educated and engaged citizenry is necessary for America to succeed and that this change must start at the local level in our homes, churches, community centers, schools, etc.

Our principles are honesty, integrity, family unity, personal responsibility, ownership of one’s community, and responsible government. Those guiding principles will allow us to build upon the great things America has stood for, does stand for, and will stand for in the future. We are strongest when our foundation is strong and the American Values Project is ready to ensure that our foundation is strong for the future!",,,2250 Double Creek Dr Unit 6661,Round Rock,TX,78683,,,,,Civic Education / Learning,,,No contact information through webpage; limited understanding of what they do; perhaps 501(c)(4) arm of American values coalition - erring on the side of inclusion - resolved 04-2024;,,Patriotic Values,,,,,30.5085915,-97.6788056,
Round Rock Police Foundation,47-4055770,501(c)(3),,Practitioner Organization,,,https://roundrockpolicefoundation.org/,"The mission of the Round Rock Police Foundation is to strengthen engagement between RRPD and the community to improve public safety and promote a higher quality of life for all Round Rock residents and visitors. We do this by promoting our own and RRPD’s programs and by supporting RRPD Officers and their families, especially in times of need.",,,1517 E Palm Valley Blvd,Round Rock,TX,78664,,(512) 494-6218,Community/Local - single,"Youth Engagement,Service and Volunteerism,Funding,Education,Dialogue",Civic Associations,,,"tag for public safety/security;

tagged/resolved 05/02",,Safety and Security,,,,,30.5085915,-97.6788056,
Senior Access,74-2692484,501(c)(3),,Practitioner Organization,,,https://senioraccesstx.org/,"Senior Access is dedicated to helping senior adults, many of whom are on very limited incomes, by providing essential transportation services at no charge. We also help our older friends and neighbors maintain an independent lifestyle in their own homes for as long as possible.",,Serita Lacasse,2498 E Palm Valley Blvd,Round Rock,TX,78665,admin@senioraccesstx.org,(512) 310-1060,Community/Local - single,Service and Volunteerism,Service & Volunteerism,,,,,"Service & Volunteerism,Community Engagement and Community Building,Social Isolation",,,,,30.5085915,-97.6788056,
