Name,EIN,Tax Class/Subsection,Shorthand,Type,Sub-Type,Parent Org,Website,Mission/Description,Network Founder,People,Street Address,City,State,Zip Code,General Contact Email,Org Phone,Location Scope,Methods,Category of Work,Funder Type,FLAG FOR REVIEW,Reason for flag/review,Self-Identified Ideology,Goals,Network Membership,Organization does not exist,Organization does not meet criteria for inclusion,Notes about not meeting criteria,Latitude,Longitude,Goal Created by AI
Texas Civic Education Coalition,,,,Practitioner Organization,,iCivics,https://texasciviceducationcoalition.org/,We are a cross-partisan coalition of over 40 organizations with a mission to improve Texas’s civic education.,Texas Civic Education Coalition,,,,TX,,Texas@iCivics.org,,State - single,"Education,Professional Training,Policy Advocacy and Analysis",Civic Education / Learning,,,,,Civic Education,CivXNow,,,,NA,NA,
Abilene Crime Stoppers,75-1753978,501(c)(3),,Practitioner Organization,,,http://www.abilenecrimestoppers.com/sitemenu.aspx?ID=126&,"Founded March 1981, Abilene Crime Stoppers, Inc. mission is to carry out a community offensive against crime through law enforcement, the media and citizen involvement, encouraging all citizens to report anonymous information about criminal activities. Offering rewards for information that helps Law Enforcement solve unsolved crimes, and arrest wanted fugitives. Abilene Crime Stoppers, achieve this goal by maintaining a Crime Stoppers Hotline, 325 676-TIPS, Website www.abilenecrimestoppers.com and free P3Tips App for smart phones. Where anonymous tips can be communicated and received. 

Tips are then forwarded to the investigating law enforcement agency helping to solve unsolved felony crimes and arrest wanted fugitives. By offering a cash reward and guaranteeing anonymity, helps tipsters to overcome their fear of retaliation and their reluctant to be involved. It gives tipsters the ability to cooperate with their respective law enforcement agencies and keep their community safer.  
 
Abilene Crime Stoppers under its umbrella funds and oversees the Campus crime stoppers program, known as Abilene Taylor County Campus Crime Stoppers. This program includes Abilene Independent School District (AISD), Wylie ISD, Trent ISD and Jim Ned ISD. The campus crime stoppers program is coordinated through the school resource officer (SRO) or school administrator or sponsor that has been assigned to the campus crime stoppers program. Tip received about criminal activity on campus is forwarded to the school resource officer or proper law enforcement agency for follow-up, helping to keep our schools safer for all students to learn and become leaders of tomorrow. 
Abilene Crime Stoppers encompasses all communities and Independent school districts in Taylor County, Texas.   ",,Rick Dorman,PO Box 717,Abilene,TX,79604,abilenecrimestoppers@gmail.com,,Community/Local - single,"Youth Engagement,Communications",,,,Do crime reporting organizations fall under democracy work? falls under public safety and security - resolved 05/02,,Safety and Security,,,,,32.44645,-99.7475905,
Woodmen of the World Life Insurance Society,23-7630185,501(c)(8),,Practitioner Organization,Chapter,,,,,,3125 Melinda Ln,Abilene,TX,79603,,,,Service and Volunteerism,Service & Volunteerism,,,chapter organization to be batched;,,Service & Volunteerism,,,,,32.44645,-99.7475905,
Woodmen of the World Omaha Woodmen Life Insurance Society,23-7629136,501(c)(8),,Practitioner Organization,Chapter,,,,,,PO Box 5589,Abilene,TX,79608,,,,Service and Volunteerism,Service & Volunteerism,,,chapter organization to be batched;,,Service & Volunteerism,,,,,32.44645,-99.7475905,
Woodmen of the World Omaha Woodmen Life Insurance Society,23-7630526,501(c)(8),,Practitioner Organization,Chapter,,,,,,2449 S Willis St Ste 101 # 5589,Abilene,TX,79605,,,,Service and Volunteerism,Service & Volunteerism,,,chapter organization to be batched;,,Service & Volunteerism,,,,,32.44645,-99.7475905,
Woodmen of the World Life Insurance Society,23-7630406,501(c)(8),,Practitioner Organization,Chapter,,,,,,1006 Bruce St,Alice,TX,78332,,,,Service and Volunteerism,Service & Volunteerism,,,chapter organization to be batched;,,Service & Volunteerism,,,,,27.7522487,-98.0697249,
Change the World Allen,83-3940450,501(c)(3),,,,,https://changetheworldallen.org/,"Change the World Allen is dedicated to developing a stronger and more resilient Allen-Lucas-Fairview community by encouraging acts of service between neighbors.   We are a 501C non-profit that equips and mobilizes community members to share their talents and help others.

Children, teens, and adults can choose from a variety of community-wide projects that serve those who need help maintaining their homes, are hungry, lonely, in need of clothing, seeking safe shelter, or longing for comfort.

 We begin each spring with Change the World Weekend.  Volunteers form work teams for various projects including home repair and yardwork, as well as food and Military support packaging.  We continue this work throughout the year as needed.",,,601 S. Greenville Ave,Allen,TX,75002,changetheworldallen@gmail.com,,Community/Local - single,"Service and Volunteerism,Community-Building / Networking,Food Justice and Access",Service & Volunteerism,,,,,Service & Volunteerism,,,,,33.1031744,-96.6705503,
Amarillo Independent School District,756000036,,,,,,,,,,,Amarillo,TX,79106,,,,Service and Volunteerism,Service & Volunteerism,,,,,Service & Volunteerism,,,,,35.20729,-101.8371192,
Amarillo United Citizens Forum,75-1898840,501(c)(3),,Practitioner Organization,,,https://www.facebook.com/amarillobhcc/,"THE OBJECTIVE IS TO PROVIDE AND ORGANIZE A CITIZENS FORUM TO SERVE THE COMMUNITY, IMPROVE COMMUNITY LIFE, AND OPERATE AND MAINTAIN A BLACK HISTORICAL CULTURAL CENTER.",,,PO Box 2353,Amarillo,TX,79105,info.aucf@gmail.com,(806) 640-8184,Community/Local - single,,Civic Associations,,,AUCF does not have a website - only a Facebook page for the cultural center; discussed and resolved 03.28.24;,,Community Engagement and Community Building,,,,,35.20729,-101.8371192,
League of Women Voters of Amarillo,75-6043959,501(c)(3),,Practitioner Organization,Chapter,,https://alwv.clubexpress.com/,"Our Mission: Empowering voters. Defending Democracy

Our Vision: We envision a democracy where every person has the desire, the right, the knowledge and the confidence to participate. 

Our Value: We believe in the power of women to create a more perfect democracy.",,"Jenny Inzerillo,Michelle Hoggatt",PO Box 19333,Amarillo,TX,79114,amarillolwv@gmail.com,(806) 337-2148,Community/Local - single,"Advocacy,Organizing,Membership,Communications,Service and Volunteerism",Voter Engagement,,,,,"Voter Engagement/Registration/Education,Diversity & Inclusion,Transparency and Addressing Mis/Disinformation",,,,,35.20729,-101.8371192,
Panhandle Community Services,756049423,,,,,,,,,,,Amarillo,TX,79101,,,,Service and Volunteerism,Service & Volunteerism,,,,,Service & Volunteerism,,,,,35.20729,-101.8371192,
Woodmen of the World Life Insurance Society,23-7143651,501(c)(8),,Practitioner Organization,Chapter,,,,,,8526 River Rd,Amarillo,TX,79108,,,,Service and Volunteerism,Service & Volunteerism,,,chapter organization to be batched;,,Service & Volunteerism,,,,,35.20729,-101.8371192,
Woodmen of the World Life Insurance Society,76-0022200,501(c)(8),,Practitioner Organization,Chapter,,,,,,1609 Alena Rd,Angleton,TX,77515,,,,Service and Volunteerism,Service & Volunteerism,,,chapter organization to be batched;,,Service & Volunteerism,,,,,29.16941,-95.4318847,
Woodmen of the World Omaha Woodmen Life Insurance Society,23-7630502,501(c)(8),,Practitioner Organization,Chapter,,,,,,1304 Fair Dr,Angleton,TX,77515,,,,Service and Volunteerism,Service & Volunteerism,,,chapter organization to be batched;,,Service & Volunteerism,,,,,29.16941,-95.4318847,
Woodmen of the World Omaha Woodmen Life Insurance Society,23-7630488,501(c)(8),,Practitioner Organization,Chapter,,,,,,1605 Alena Rd,Angleton,TX,77515,,,,Service and Volunteerism,Service & Volunteerism,,,chapter organization to be batched;,,Service & Volunteerism,,,,,29.16941,-95.4318847,
Cross Timbers Equestrian Trails Association,75-2841066,501(c)(3),,Practitioner Organization,,,https://www.cteta.org/,"Welcome to Cross Timbers Equestrian Trails Association (CTETA)—a 501(c)(3) nonprofit organization dedicated to trail stewardship. Since our founding in 1993, our mission has been to develop, maintain, and preserve equestrian trails while promoting responsible trail use and safety through volunteering, education and membership.

Our goal is simple: to allow the maximum number of people to enjoy the beautiful trails of our area on horseback!
CTETA volunteers maintain more than 25 miles of trails here in North Texas. The work of our trail ambassadors helps to create a safe experience for our riders and includes clearing deadfall, cutting back brush, and mowing the grass. Without us, many of these trails would cease to exist entirely. 

As with most government agencies, the U.S. Army Corps of Engineers is faced with cutbacks and limited funds for trail improvements. Club membership dues can only go so far. Therefore, it is important to have a strong membership base, not only for funds to support the trail maintenance, but for education and a continued strong voice in local matters of trail preservation and acquisition of land for connecting trails.  ",,Susan Bodenmiller,PO BOX 155,ARGYLE,TX,76226,ctetaboard@gmail.com,,Community/Local - single,"Education,Service and Volunteerism,Communications,Membership",Service & Volunteerism,,,,,"Community Engagement and Community Building,Service & Volunteerism",,,,,33.110156,-97.179757556481,
True Texas Education Corporation,85-4347442,501(c)(3),,Practitioner Organization,,,https://truetexaseducation.com/,"THE CORPORATION IS ORGANIZED FOR EDUCATIONAL ACTIVITIES. 1. TO TEACH, CONTINUOUSLY TRAIN, AND INSPIRE TEXANS TO ENGAGE IN GOVERNMENTS AT EVERY LEVEL. 2. TO HELP TEXANS BECOME ACTIVE PARTICIPANTS IN THEIR SELF GOVERNANCE THAT IS ESTABLISHED IN OUR DECLARATION OF INDEPENDENCE, BY EMPHASIS ON HISTORIC BACKGROUND, UNDERSTANDING GOVERNMENTAL PROCESSES, ORIG DOCUMENTS, AND ANALYZING CURRENT EVENTS AS THEY RELATE TO TEXAS CITIZENS.",,,2029 WINTER SUNDAY WAY,ARLINGTON,TX,76012,admin@truetexaseducation.com,,State - single,Education,Civic Education / Learning,,,,,Civic Knowledge,,,,,32.7355816,-97.1071186,
Police Foundation - Arlington TX,73-1662006,501(c)(3),,"Practitioner Organization,Funder",,,https://arlingtonpolicefoundation.org/,"The Arlington Police Foundation supports and supplements the efforts of the Arlington, Texas Police Department through officer resources, youth programs, recognition of outstanding service and scholarships. By funding equipment and programs that might be unfunded by the city budget, The Arlington Police Foundation allows our officers to focus on what is important in our community: crime prevention and the safety of our constituents.",,Bethany Tinderholt,PO Box 2318,Arlington,TX,76004,bethany@arlingtonpolicefoundation.org,(682) 777-3253,Community/Local - single,"Funding,Youth Engagement",Civic Associations,Community Foundation,,"tag for public safety/security; 

tagged/resolved 05/02",,"Civic Infrastructure Development,Community Engagement and Community Building,Safety and Security",,,,,32.7355816,-97.1071186,
19th News,84-2627202,501(c)(3),,Practitioner Organization,,,https://19thnews.org/,"The 19th Amendment remains unfinished business, a fact we acknowledge in our logo with an asterisk — a visible reminder of those who have been omitted from our democracy. The expansion of the franchise continues today, and The 19th aims to capture this ongoing American story.

Our goal is to empower those we serve — particularly women, people of color, and those historically underserved by American media — with the information, resources and community they need to be equal participants in our democracy.",The 19th News Network,Emily Ramshaw,3571 FAR WEST BLVD 3497,AUSTIN,TX,78731,hello@19thnews.org,,,"Journalism,Print and Digital Publication,Dialogue",Civic Media,,,"Established new network in 2024; network seems to be a part of larger democracy work, but some founding partners work beyond that scope (e.g., TeenVogue); added to coaltions - resolved 05/02",,"Civic Journalism,Diversity & Inclusion",The 19th News Network,,,,30.2711286,-97.7436995,
Austin Investigative Reporting Project (d.b.a. The Austin Bulldog),27-0231463,501(c)(3),d.b.a. The Austin Bulldog,Practitioner Organization,,,https://theaustinbulldog.org/,"The Austin Bulldog is a nonprofit independent online news site for investigative reporting in the public interest. The Austin Bulldog is dedicated to hard-nosed journalism covering topics that matter. Our primary focus is almost entirely on what’s happening in our hometown, the city of Austin, Texas, although we will occasionally cover important stories on the outskirts. We will investigate matters involving government, media, politics, and anything else warranting close scrutiny that’s within our resources. We will strive to be an important source of news on the topics we cover. The Austin Bulldog is nonprofit, nonpartisan and non-advocacy. We will question authority. We will go where the facts lead us and report accordingly. We set high standards for our reporting. It must be accurate. It must be factual. It must be fair. We adhere to the  Society of Professional Journalists Code of Ethics(http://www.spj.org/ethicscode.asp) . We seek to advance the cause of democracy, freedom of information and open government.",,Ken Martin,2028 E BEN WHITE BLVD STE 2406115,AUSTIN,TX,78741,,(512) 426-6115,Community/Local - single,"Print and Digital Publication,Crowdsourcing",Civic Media,,,,,"Civic Journalism,Transparency and Addressing Mis/Disinformation",,,,,30.2711286,-97.7436995,
Every Voice Texas (d.b.a. Asian Texans for Justice),87-2407966,501(c)(3),d.b.a. Asian Texans for Justice,Practitioner Organization,,,https://www.asiantexansforjustice.org/,We connect Asian and Pacific Islander Texans to civic action to build personal and political power.,,Lily Trieu,4321 HOUSE OF YORK,AUSTIN,TX,78730,info@asiantexansforjustice.org,,State - single,"Youth Engagement,Leadership Training,Policy Advocacy and Analysis,Research,Communications,Dialogue,Narrative Storytelling,Community-Building / Networking,Education,Advocacy",Organizing & Advocacy,,,,,"Voter Engagement/Registration/Education,Diversity & Inclusion,Leadership Development for Healthy Democracy,Social Justice",,,,,30.2711286,-97.7436995,
League of Women Voters of Texas Action Fund,74-1106488,501(c)(4),,Practitioner Organization,Chapter,,https://www.lwvtexas.org/,"MISSION
Empowering Voters. Defending Democracy.

VISION
We envision a democracy where every person has the desire, the right, the knowledge and the confidence to participate.  

VALUE
We believe in the power of women to create a more perfect democracy.",,Joyce LeBombard,1212 GUADALUPE ST STE 107,AUSTIN,TX,78701,,(512) 472-1100,State - single,,Voter Engagement,,,,,"Voter Engagement/Registration/Education,Diversity & Inclusion",,,,,30.2711286,-97.7436995,
Progress Texas Institute,61-1639490,501(c)(3),,Practitioner Organization,Journalism/Media,,https://progresstexas.org/,The Progress Texas Institute provides research and strategic communications on issues with the ultimate goal of increasing civic engagement.,,Kathleen Thompson,PO BOX 162922,AUSTIN,TX,78716,social@progresstexas.org,(512) 814-6252,"""State - multiple, not region-specific""","Podcasts/Radio,Print and Digital Publication",Civic Media,,,,,Civic Journalism,,,,,30.2711286,-97.7436995,
Texas Blue Action Fund,86-3279257,501(c)(4),,Practitioner Organization,,,https://www.texasblueaction.com/,On a mission to expand the electorate and build long-term sustainable Democratic organizing infrastructure in Texas.,,Lana Hansen,PO BOX 41424,AUSTIN,TX,78704,info@blueactiondems.com,,"State - single,Community/Local - multiple","Organizing,Community-Building / Networking,Service and Volunteerism,Youth Engagement,Education","Voter Engagement,Organizing & Advocacy",,,,,Voter Engagement/Registration/Education,,,,,30.2711286,-97.7436995,
Texas Freedom Network Education Fund (TFNEF),74-2788317,501(c)(3),TFNEF,Practitioner Organization,,,https://tfn.org/,"TFNEF is a statewide non-partisan, grassroots organization that is building an informed and effective movement for equality and social justice.",,Val Benavidez,PO BOX 1624,AUSTIN,TX,78767-1624,tfn@tfn.org,(512) 322-0545,State - single,"Advocacy,Education,Print and Digital Publication,Funding",Organizing & Advocacy,,,,,"Social Justice,Civil and Political Rights,Interfaith Organizing/Engagement",,,,,30.2711286,-97.7436995,
The Onestar Foundation (ONSC),20-0445492,501(c)(3),ONSC,Funder,,,https://onestarfoundation.org/,"OneStar National Service Commission (ONSC) works in conjunction with OneStar Foundation (OSF) to build a stronger nonprofit sector for a better Texas. As Texas' Governor-designated state service commission, the ONSC administers $18 million in federal funding per year to a portfolio of AmeriCorps Texas programs (made up of nonprofits, state agencies, and P-16 educational institutions) that leverages additional match funding from local communities. These programs serve local needs, raise their own required match funding, apply through a highly competitive process, and meet rigorous standards to receive funding. OSF oversees grant making and administration,  evaluation, monitoring, training and technical support to bring these critical funds to Texas and advance the field of national service.",,Chris Bugbee,2200 E MARTIN LUTHER KING JR 100,AUSTIN,TX,78702,info@onestarfoundation.org.,(512) 287-2000,State - single,"Leadership Training,Professional Training,Funding",Service & Volunteerism,Community Foundation,,,,Service & Volunteerism,,,,,,,
Access Empowerment,45-4767467,501(c)(3),,Practitioner Organization,,,https://www.parkingmobility.com/,"Access Empowerment engages disability communities and local governments in eight states to raise awareness on disabled parking abuse and provide a long-term solution utilizing technology and education, impacting over 4.5 million individuals. Additionally, our mission is to empower people with disabilities through technology. We are located in Austin, TX.",,Mack Marsh,1101 W 34th St Ste 175,Austin,TX,78705,,(512) 348-7775,,"Education,Technology",Civic Associations,,,,,"Diversity & Inclusion,Community Engagement and Community Building",,,,,30.2711286,-97.7436995,
American YouthWorks,742197942,,,,,,,,,,,Austin,TX,78741,,,,Service and Volunteerism,Service & Volunteerism,,,,,Service & Volunteerism,,,,,30.2711286,-97.7436995,
Annette Strauss Institute for Civic Life at the University of Texas at Austin,,,,Practitioner Organization,Campus Initiative,University of Texas at Austin,https://straussinstitute.moody.utexas.edu/,"The Annette Strauss Institute for Civic Life’s mission is to educate, inspire, and connect the next generation of Texas civic leaders. The institute has provided experiential civic education opportunities for tens of thousands of students across Texas. We are in the business of giving students at The University of Texas at Austin and colleges, high schools, middle schools, and elementary schools across the state the knowledge, skills, attitudes, and dispositions for constructive civic involvement and leadership.

The Institute’s research projects provide critical insight for practitioners and scholars alike. We analyze how politically and civically involved Texans are in their communities and state. Students work alongside faculty on research projects to more deeply understand how the public, the media, and elected officials communicate about politics and civic life.",,Mark Strama,2504 A Whitis Avenue (R2000),Austin,TX,78712,strauss.institute@austin.utexas.edu,(512) 471-1959,State - single,"Research,Dialogue,Youth Engagement,Leadership Training",Civic Education / Learning,,,,,"Civic Education,Youth Engagement and Leadership,Leadership Development for Healthy Democracy","CivXNow,FixUS",,,,30.2711286,-97.7436995,
AUSTIN ACHIEVE PUBLIC SCHOOLS,273700807,,,,,,,,,,,Austin,TX,78723,,,,Service and Volunteerism,Service & Volunteerism,,,,,Service & Volunteerism,,,,,30.2711286,-97.7436995,
Austin Creative Reuse,271275644,,,,,,,,,,,Austin,TX,78723,,,,Service and Volunteerism,Service & Volunteerism,,,,,Service & Volunteerism,,,,,30.2711286,-97.7436995,
Austin Parks Foundation,74-2648803,501(c)(3),,Funder,,,https://austinparks.org/,"Austin Parks Foundation partners with our community to enhance people’s lives by making our public parks, trails and green spaces better through volunteerism, innovative programming, advocacy and financial support.",,Colin Wallis,PO Box 6160,Austin,TX,78762,apf@austinparks.org,(512) 477-1566,Community/Local - single,"Service and Volunteerism,Funding,Advocacy",Service & Volunteerism,,,,,"Service & Volunteerism,Social Justice",,,,,30.2711286,-97.7436995,
"AUSTIN, CITY OF",746000085,,,,,,,,,,,Austin,TX,78744,,,,Service and Volunteerism,Service & Volunteerism,,,,,Service & Volunteerism,,,,,30.2711286,-97.7436995,
Babes Fest Inc (a.k.a. Future Front Texas),81-5349740,501(c)(3),a.k.a. Future Front Texas,Practitioner Organization,,,https://futurefronttexas.org/,"Homegrown in Austin, Future Front is an award-winning culture space and exhibition series—with women and LGBTQ+ creatives at the front. 

As a 501c3 arts & culture nonprofit, we produce two community-led exhibitions, the Front Market & the Front Festival. 

Beyond our flagship exhibitions, we host year-round shows and workshops at our creative space in historic East Austin, welcoming 20,000+ visitors per year. Through these programs and a diverse network of partnerships, we invite the public to dream of a future where creativity, curiosity and intersectional design thrive in Texas—where we see ourselves and our cultures reflected in our communities.",,Jane Hervey,5201 Park At Woodlands Dr,Austin,TX,78724,hello@futurefronttexas.org,,Community/Local - single,"Arts and Culture,Supporting Women/BIPOC-owned groups,Community-Building / Networking",,,,,,"Civic Arts,Community Engagement and Community Building,Diversity & Inclusion",,,,,30.2711286,-97.7436995,
Better Choices,,,,Practitioner Organization,Think Tank,,https://BetterChoices.vote,Creating a representative democracy and ending polarization by promoting election systems that elect a candidate the voters prefer to any other candidate wins.,,Robbie Robinette,2500 Hatley Drive,Austin,TX,78746,RobbieRobinette@betterChoices.vote,(512) 666-4427,National,,Electoral Reform,,,,,"Voting Research,Electoral Reform,Responsive Governance",NANR,,,,30.2711286,-97.7436995,
Breakthrough,742991346,,,,,,,,,,,Austin,TX,78702,,,,Service and Volunteerism,Service & Volunteerism,,,,,Service & Volunteerism,,,,,30.2711286,-97.7436995,
Capital of Texas Media Foundation,46-3398438,501(c)(3),,Practitioner Organization,,,https://www.austinmonitor.com/cotmf/,"The Capital of Texas Media Foundation (CoTMF) is a nonprofit media company that empowers Central Texans with the news and information they need to to understand and influence local civic and social issues. CoTMF is home to two digital publications, the Austin Monitor and (through a fiscal sponsorship) GivingCity Austin. These entities publish independently and serve as the premiere news sources for local leaders, change-makers, activists and volunteers.

CoTMF puts content to work in service to the community. Our mission is to positively impact our community through content - online and in person - and increase the number of Central Texas activists, volunteers, voters and donors.",,,1023 Springdale Rd Ste 1j,Austin,TX,78721,director@cotmf.org ,,Community/Local - single,"Research,Youth Engagement,Print and Digital Publication",Civic Media,,,,,Civic Journalism,,,,,30.2711286,-97.7436995,
Children's Defense Fund of Texas,52-0895622.,,,Practitioner Organization,,,https://cdftexas.org/,"We envision a Texas where all children have an equal chance to thrive, regardless of their race, income, or immigration status. They are our future, and they are already leading in our communities today. We champion state and local public policies that systematically expand access to the resources Texas children need at every stage of their youth. We do this by speaking to legislators, publishing research, and organizing Texans like you to advance the changes our communities need.",,,1910 E. MLK Jr. Blvd.,Austin,TX,78702,cdftexas@childrensdefense.org,(713) 664-4080,,,"Civic Education / Learning,Organizing & Advocacy",,,,,"Youth Engagement and Leadership,Public Health,Civic Education","50x2026,SLSV",,,,30.2711286,-97.7436995,
Citizen Discourse,,,,Practitioner Organization,,,https://citizendiscourse.org/,"Our mission is to support the development of self-aware and empathetic global citizens prepared to contribute to the advancement of a more just and compassionate society. Through workshops, trainings and consulting, we help you build trust, and create space for productive conversations.",,Karen Gross,4802 Gladeview Dr.,Austin,TX,78745,info@citizendiscourse.org,(512) 799-0348,National,"Education,Dialogue,Deliberation,Youth Engagement,Mental Health",Connecting Across Differences,,,,,"Bridging Divides,Healing Justice,Social Isolation","Citizen Connect,CivXNow,FixUS,Listen First Coalition",,,,30.2711286,-97.7436995,
